url,title,image,publisher,publisher_url,snippet,score,position,category,firstviewed,lastviewed,is_new,is_headline,is_short,is_showcase,is_video,is_webstory,entities,"social channel"
https://www.elnortedecastilla.es/valladolid/provincia/casetas-obra-atender-pacientes-consulta-boecillo-20250218065107-nt_amp.html,"Valladolid: Casetas de obra para atender a los pacientes en la consulta de Boecillo",https://cache.discoversnoop.com/cb9ad3cac4ae51b215a73e5622fb5b7156cfba443ec1f9b593eb51cc469a6e1b-1739864170.jfif,"El Norte de Castilla",elnortedecastilla.es,"El centro de salud de la localidad lleva diez meses de reforma y algunos vecinos muestran su hartazgo por la situación",0,13,/News,"2025-02-18 08:34:21","2025-02-18 08:34:21",,,,,,,"Castilla, Centro de salud, León, Provincia de Valladolid",
https://okdiario.com/espana/confirmado-boe-requisitos-ser-reservista-voluntario-del-ejercito-espana-16580996/amp,"Confirmado por el BOE: los requisitos para ser reservista voluntario del Ejército de España",https://cache.discoversnoop.com/e03eaf134f2902fdd5c68a5a583b22470764f27c7a483dc5f2a065456da1e770-1776113941.jfif,OkDiario,okdiario.com,"Requisitos para ser reservista voluntario en España: edad, formación, condiciones y cómo solicitarlo según la normativa vigente.",0,12,"/Law & Government/Military","2026-04-13 22:52:27","2026-04-14 07:46:46",,,,,,,"Ejército, Ejército de Tierra, Reservista",
https://dxtadaptado.com/el-boe-confirma-el-nuevo-cambio-de-hora-de-invierno-de-2025-este-sera-el-dia/,"EL BOE confirma el nuevo cambio de hora de invierno de 2025: este será el día",https://cache.discoversnoop.com/924358882fa9acc7f9321f8afa1a566440f8096d952c9d99dcecaafb37f8d90c-1758420154.jfif,dxtadaptado,dxtadaptado.com,"Con la llegada del otoño y las jornadas más cortas de luz solar, se acerca uno de los ajustes más esperados del calendario: el cambio al horario de invierno.",0,20,"/Reference/General Reference/Time & Calendars","2025-09-21 03:56:12","2025-09-21 08:16:34",,,,,,,"Horario de invierno",
https://noticiastrabajo.huffingtonpost.es/empleo/oposiciones/el-boe-avisa-de-nuevas-oposiciones-con-mas-de-1950-plazas-en-noviembre-para-ser-funcionario-de-carrera/,"El BOE avisa de 1.950 nuevas plazas en noviembre para ser funcionario de carrera",https://cache.discoversnoop.com/09c5a25317fafb65bdc0ac9fc47de1702a3145e60ea5683acf432fd406129cd2-1762255359.jfif,Noticiastrabajo,huffingtonpost.es,"El Boletín Oficial del Estado ha publicado esta semana 174 convocatorias con 1.952 plazas entre las que destacan las 1.033 para trabajar como profesor de Enseñanza Secundaria.",0,12,"/Jobs & Education/Jobs/Job Listings","2025-11-04 12:18:09","2025-11-04 18:24:42",,,,1,,,"Empleo público, Funcionario público, Oposición, Personal laboral",
https://www.20minutos.es/lainformacion/economia-y-finanzas/menos-salario-eguridad-social-boe-mecanismo-equidad-intergeneracional-pensiones_6513290_0.amp.html,"Confirmado por el BOE: la nueva reducción en las nóminas que entrará en vigor el 1 de enero de hasta 95 euros menos",https://cache.discoversnoop.com/c4e61da4db30ca599b2bc70d7683df162fa938a7d3b720f30b035186dcb53d28-1761602191.jfif,20Minutos,20minutos.es,"Según ha confirmado el BOE, el descuento del Mecanismo de Equidad Intergeneracional afectará a los trabajadores para reforzar la hucha de las pensiones.",0,15,"/Finance/Financial Planning & Management/Retirement & Pension","2025-10-27 22:53:58","2025-10-28 01:49:58",,,,,,,"Nómina, Seguridad Social",
https://elfarodeceuta.es/boe-ayuda-por-hijo-a-cargo-2026/amp/,"El BOE lo hace oficial: las familias podrán acceder a ayudas por hijo a cargo en 2026",https://cache.discoversnoop.com/29844e8748461ea343d4cb786f34bbdecfc8a42dfbe7260f2a4c6010a9871a58-1767179154.jfif,"El Faro de Ceuta",elfarodeceuta.es,,0,11,"/Law & Government/Social Services","2025-12-31 12:01:33","2026-01-02 18:08:58",,,,,,,"Familia numerosa, Ingreso mínimo vital",
https://www.eleconomista.es/galerias/eleconomista/24003/Es-oficial-el-BOE-confirma-que-los-propietarios-pueden-reclamar-a-la-comunidad-los-gastos-provocados-por-goteras-2,"Es oficial: el BOE confirma que los propietarios pueden reclamar a la comunidad los gastos provocados por goteras",https://cache.discoversnoop.com/b215811e42ab02347c252073b7bc618a4ea403d96a285f890f6337b01e8d3359-1769772891.jfif,"El Economista",eleconomista.es,"Los problemas de goteras parecen ser de los más frecuentes en una comunidad de vecinos, sobre todo, porque suele requerir la ayuda y asistencia del vecino cuya vivienda ha ocasionado dicha avería. De hecho, puede afectar a varias viviendas a la vez y el arreglo para solventar el problema d",0,7,"/Law & Government/Legal","2026-01-30 12:28:58","2026-01-30 17:43:50",,,,,,,"Gotera, Propiedad horizontal",
https://amp.elmundo.es/economia/2025/09/29/68da2e3121efa09c368b457d.html,"Nueva ayuda en nómina: el BOE aprueba deducciones de hasta 340 euros para miles de empleados",https://cache.discoversnoop.com/7376e77987e14392f72df3aef51bd48b3a235a14775d0bd8ad985188122c4272-1759141649.jfif,"El Mundo",elmundo.es,"La Ley 5/2025, publicada en el Boletín Oficial del Estado (BOE), recoge una deducción específica en el IRPF, que puede alcanzar los 340 euros, siempre y cuando se cumplan dos condi",0,11,"/Business & Industrial/Business Operations","2025-09-29 12:23:43","2025-09-29 12:49:19",,,,,,,Nómina,
https://okdiario.com/economia/boe-lo-confirma-festivo-lunes-pascua-6-abril-alargan-semana-santa-estas-comunidades-16447784/amp,"El BOE lo confirma: es festivo el Lunes de Pascua, 6 de abril, y alargan la Semana Santa estas comunidades",https://cache.discoversnoop.com/ae8f20cbdc464581fa47da7f08b32b551fb32c3dd432b80a54f6c7a2a5703924-1774095253.jfif,OkDiario,okdiario.com,"El lunes 6 de abril es el Lunes de Pascua, y en algunas comunidades se podrá disfrutar de un puente aprovechando la Semana Santa.",0,9,"/Hobbies & Leisure/Special Occasions/Holidays & Seasonal Events","2026-03-21 13:10:20","2026-03-21 15:43:31",,,,,,,"Calendario laboral, Pascua",
https://noticiastrabajo.huffingtonpost.es/economia/miles-trabajadores-notaran-nomina-nueva-deduccion-hasta-340-euros-aprobada-boe/,"Miles de trabajadores notarán en la nómina una nueva deducción de hasta 340 euros aprobada en el BOE",https://cache.discoversnoop.com/00d2f4dde217c4cfd1f13ab79b2db2ffb87fe3c4b47d0a3b96294f66cd29528a-1758498343.jfif,Noticiastrabajo,huffingtonpost.es,"Los asalariados que perciban menos de 18.276 euros al año podrán acceder a una nueva deducción en el IRPF de hasta 340 euros, según establece la Ley 5/2025 publicada en el Boletín Oficial del Estado.",0,8,"/Finance/Accounting & Auditing/Tax Preparation & Planning","2025-09-21 16:41:30","2025-09-22 11:41:23",,,,,,,Nómina,
https://www.lasprovincias.es/comunitat/ampliacion-enlace-bypass-valencia-2028-20251219093753-nt.html,"El BOE publica la mejora del enlace de la A-3 pero esta no llegará antes de 2028",https://cache.discoversnoop.com/c6e9cc1315fe3ff8f255d910a7d90f2e587fc220585d9d977ebb99f665b2110c-1766188385.jfif,"Las Provincias",lasprovincias.es,"El proyecto supera los 3,3 millones de presupuesto y busca solventar el embudo que se genera para acceder al by-pass al haber un solo carril",0,19,"/Business & Industrial/Construction & Maintenance","2025-12-20 00:48:41","2025-12-20 04:48:31",,,,,,,"Autovía del Este",
https://www.farodevigo.es/deza-tabeiros-montes/2025/09/10/tiron-galo-carboeiro-121411829.amp.html,"El tirón galo de Carboeiro",https://cache.discoversnoop.com/8a2aa80726e1ca5056426c652a6a670640332a71556518abd45277f00ddcaafe-1757579530.jfif,"Faro de Vigo",farodevigo.es,"El monasterio recibió en agosto 2.872 visitas, doscientas más que el mismo mes del año anterior. El 41% procedía de Galicia y el 56%, de otros puntos de España. De los 230 extranjeros (3%), 78 procedían de Francia.",0,23,"/Travel/Tourist Destinations","2025-09-11 10:29:09","2025-09-11 11:14:52",,,,,,,,
https://www.eldiadevalladolid.com/noticia/z3e576953-8bd1-467d-918924997f1ff1f1/202602/denuncian-a-boecillo-por-incumplir-la-ley-de-bienestar-animal,"Denuncian a Boecillo por incumplir la ley de bienestar animal",https://cache.discoversnoop.com/4800270fbb6034048c409c116b65014907be68070021705a5c8eb6850e649101-1770498055.jfif,"El Día de Valladolid",eldiadevalladolid.com,"La demanda contra el Ayuntamiento, admitida a trámite por el juzgado, subraya la ""situación crítica de las colonias felinas"" del municipio y la falta de protocolos municipales para prestar atención a animales abandonados o heridos",0,17,"/Pets & Animals","2026-02-07 21:56:22","2026-02-07 22:40:11",,,,,,,"Bienestar animal",
https://www.infobierzo.com/ponferrada/mas-millon-euros-transformar-margen-derecho-rio-boeza-ponferrada_1034043_102_amp.html,"Más de un millón de euros para transformar el margen derecho del río Boeza en Ponferrada",https://cache.discoversnoop.com/64d5df04b35ef2670ed2b8b1b24f3fbd4d89d0837277b659f393af21fdb2debe-1774505370.jfif,"Info Bierzo",infobierzo.com,"La Confederación Hidrográfica del Miño-Sil (CHMS) ha sometido a información pública el proyecto de restauración del entorno de la margen derecha del río Boeza",0,10,"/Business & Industrial/Construction & Maintenance","2026-03-26 01:09:57","2026-03-26 07:04:55",,,,,,,Ponferrada,
https://www.huffingtonpost.es/politica/confirmado-boe-precio-bombona-butano-sube-fuerza-f202603.html?outputType=amp,"Confirmado por el BOE: el precio de la bombona de butano sube hasta casi su límite",https://cache.discoversnoop.com/2297b3797b29bb57c6bd8edfe0245401278d27f9f040a57485f32961e623d2ef-1773832842.jfif,"El HuffPost",huffingtonpost.es,"La revisión se produce en un contexto marcado por el encarecimiento de los costes energéticos y las tensiones en Oriente Medio.",0,12,"/Business & Industrial/Energy & Utilities/Oil & Gas","2026-03-18 12:15:16","2026-03-18 12:26:56",,,,,,,Butano,
https://www.heraldo.es/noticias/nacional/2025/09/16/boe-oficial-seguro-patinetes-bicicletas-electricas-obligatorio-1854420.html,"El BOE lo hace oficial: el seguro para patinetes y bicicletas eléctricas será obligatorio a partir de este día",https://cache.discoversnoop.com/77e0e6aad90dd86c0b1058cde0d410a22f2da5f68a35b5ee4153ad4afe0e4670-1758133650.jfif,Heraldo.es,heraldo.es,"Estos vehículos han reconfigurado la forma en la que los ciudadanos se desplazan por las ciudades, pero también han generado un paisaje urbano saturado.",0,13,/Finance/Insurance,"2025-09-17 20:24:51","2025-09-18 08:42:30",,,,1,,,"Patinete eléctrico",
https://www.elnortedecastilla.es/palencia/boedo-suma-familia-programa-repuebla-calahorra-20250730065717-nt_amp.html,"El Boedo suma una familia con el programa Repuebla Calahorra",https://cache.discoversnoop.com/4acd622218ae2267a20e724492fc289f60b8839a21a4689079a34f19514f8b9a-1753900883.jfif,"El Norte de Castilla",elnortedecastilla.es,"Silvia Fernández lleva un año viviendo en Calahorra de Boedo con sus dos hijos",0,17,/News,"2025-07-30 20:38:06","2025-08-01 23:18:39",,,,,,,"Calahorra de Boedo",
https://okdiario.com/comunidad-valenciana/oficial-boe-confirma-festivo-del-9-octubre-puente-ciudades-15505984/amp,"Es oficial: el BOE confirma el festivo del 9 de octubre y habrá puente en estas ciudades",https://cache.discoversnoop.com/111bcef923d177688a32d606b0485291e3a41e794e2b0e1dd122d77d3f6133b6-1759774088.jfif,OkDiario,okdiario.com,"El jueves 9 de octubre es festivo en la Comunidad Valenciana ya que se celebra el día de la comunidad. Todo lo que dice el BOE.",0,15,"/Hobbies & Leisure/Special Occasions/Holidays & Seasonal Events","2025-10-06 20:03:48","2025-10-07 03:15:31",,,,,,,"Calendario laboral, Día de la Comunidad Valenciana",
https://elpueblodeceuta.es/art/109857/el-boe-notifica-un-expediente-sancionador-para-un-vecino-de-ceuta-por-incumplir-la-normativa-de-playas,"El BOE notifica un expediente sancionador para un vecino de Ceuta por incumplir la normativa de playas",https://cache.discoversnoop.com/442899fc647e1319215c54a7a003a1942b0440f3d1600407ab34ffbf6c97f0ef-1752680013.jfif,"El Pueblo de Ceuta",elpueblodeceuta.es,"El interesado podrá interponer recurso potestativo de reposición en el plazo de un mes, ante el mismo órgano que dictó la resolución",0,8,"/Travel/Tourist Destinations/Beaches & Islands","2025-07-16 17:31:18","2025-07-18 00:42:48",,,,,,,Notificación,
https://noticiastrabajo.huffingtonpost.es/amp/economia/consumo/el-precio-de-la-gasolina-y-diesel-se-desploman-hoy-lunes-con-la-entrada-en-el-boe-de-la-bajada-del-iva-las-gasolinas-mas-baratas-por-provincias/,"El precio de la gasolina y diésel se desploman hoy lunes con la entrada en el BOE de la bajada del IVA: las gasolineras más baratas por provincias",https://cache.discoversnoop.com/c6238684aa52abab8554acba13472cb85fc2c4aee4079ed331909d29b72543ee-1774340222.jfif,Noticiastrabajo,huffingtonpost.es,"Tras la entrada en vigor de la bajada del IVA de los carburantes del 21% al 10%, el precio de la gasolina se sitúa en los 1,617 y el diésel a los 1,802.",0,8,"/Autos & Vehicles/Vehicle Parts & Services/Gas Prices & Vehicle Fueling","2026-03-24 09:12:19","2026-03-24 10:40:00",,,,,,,Combustible,
https://www.bbc.com/mundo/articles/cd0vvrk24zdo,"Accidente de Air India: el 787 Dreamliner de Boeing se consideraba el avión más seguro, pero personas dentro de la empresa tenían serias dudas",https://cache.discoversnoop.com/64fa43a21fad56a7c90a02ffcfd4c5570ff830247bda64a9e14cbe40b91960e2-1751419837.jfif,BBC,bbc.com,"La aeronave ha transportado cerca de mil millones de pasajeros en casi 15 años de funcionamiento, pero varios empleados y exempleados de Boeing han planteado dudas sobre su fabricación.",0,9,"/Sensitive Subjects","2025-07-01 15:59:05","2025-07-03 06:12:47",,,,,,,"Aviones, Boeing 787, Vuelos",
https://caracol.com.co/2025/10/08/historico-aterrizaje-de-un-boeing-737-max-8-en-el-aeropuerto-internacional-matecana-de-pereira/,"Histórico aterrizaje de un Boeing 737 Max-8 en el Aeropuerto Internacional Matecaña de Pereira",https://cache.discoversnoop.com/becaca1b431725ab278b0b820f0317374dfc638b84462f1dcd6b7bfb6387e676-1759970390.jfif,"Caracol Radio",caracol.com.co,"Es el avión más grande que ha llegado a la región cafetera. ",0,12,"/Travel/Air Travel","2025-10-08 20:36:36","2025-10-10 07:40:57",,,,,,,"Avión, Boeing, Vuelo",
https://www.ultimahora.es/xaloc/dudas-respuestas/2025/08/21/2453493/boe-confirma-instalar-maquina-aire-acondicionado-fachada-esta-prohibido-segun-ley-propiedad-horizontal.html,"El BOE lo confirma: instalar la máquina de aire acondicionado en la fachada está prohibido, según la ley de Propiedad Horizontal",https://cache.discoversnoop.com/7c0c8954b4350cc9078b0cd2b80c5b0f00a5b4631ae2d07568142f16ce88db44-1755824250.jfif,"Ultima Hora",ultimahora.es,"Un experto de Millennials Abogados detalla las implicaciones legales y las excepciones contempladas en la normativa que afecta a millones de comunidades de vecinos. La instalación de aparatos de aire acondicionado en las fachadas de edificios está expresamente prohibida según establece la ",0,6,"/Home & Garden/HVAC & Climate Control","2025-08-22 02:53:49","2025-08-23 05:49:05",,,,,,,"Aire acondicionado, Climatización, Fachada, Propiedad horizontal",
https://www.cope.es/actualidad/economia/noticias/confirmado-boe-200-000-funcionarios-afectados-reduccion-jornada-35-horas-20260416_3346355.amp.html,"Confirmado por el BOE: Más de 200.000 funcionarios afectados por la reducción de jornada a 35 horas",https://cache.discoversnoop.com/1d3811bf5407e7744e2fd2588a290a272887e2c39dc8924f4b72f38584b6c4d8-1776325083.jfif,COPE,cope.es,"La medida, publicada en el Boletín Oficial del Estado, establece un plazo de un mes para que los ministerios adapten los nuevos calendarios y horarios",0,14,"/Law & Government/Government","2026-04-16 09:31:29","2026-04-17 16:49:36",,,,,,,"Funcionario público",
https://noticiastrabajo.huffingtonpost.es/amp/empleo/oposiciones/el-boe-sorprende-con-una-gran-convocatoria-de-oposiciones-2377-plazas-para-ser-funcionario-de-carrera-y-nuevas-bolsas-de-empleo-publico/,"El BOE sorprende con una gran convocatoria de oposiciones: 2.377 plazas para ser funcionario de carrera y nuevas bolsas de empleo público",https://cache.discoversnoop.com/b7c75efd5467cc89cab3fabc1ba517340928f4d22d63d693c5dc932b7e8c101b-1757418779.jfif,Noticiastrabajo,huffingtonpost.es,"El Boletín Oficial del Estado ha publicado 88 convocatorias de oposiciones en las que 13 son para trabajar en la administración pública sólo con la ESO y 7 con Bachillerato.",0,12,"/Jobs & Education/Jobs/Job Listings","2025-09-09 13:50:58","2025-09-09 14:27:58",,,,,,,"Empleo público, Oposición",
https://www.diariodevalladolid.es/valladolid/provincia/250415/269909/transportes-retoma-desdoblamiento-n-601-olmedo-boecillo-valladolid-tras-error-primer-expediente_amp.html,"Transportes retoma el desdoblamiento de la N-601 entre Olmedo y Boecillo tras un error en el primer expediente",https://cache.discoversnoop.com/1a5bd2b8fa312dd416f37d7c74e548989f3cbba915ab99166bb0e9c87d9c0708-1744790413.jfif,"Diario de Valladolid",diariodevalladolid.es,"El Ministerio que dirige Óscar Puente vuelve a licitar el diseño para alargar la autovía hasta Mojados y para crear un carril adicional hasta Olmedo",0,6,"/Business & Industrial/Construction & Maintenance","2025-04-16 09:59:01","2025-04-16 09:59:01",,,,,,,"Óscar Puente",
https://www.preferente.com/noticias-de-transportes/noticias-de-aerolineas/el-mayor-lessor-chino-compra-50-boeing-y-70-airbus-de-una-vez-342714.html,"El mayor ‘lessor’ chino compra 50 Boeing y 70 Airbus de una vez",https://cache.discoversnoop.com/c19bb61bca8c8729d0b326fc2a2e45bf730934f3f5dd6ec6839474514f077467-1743587933.jfif,Preferente.com,preferente.com,"Son Airbus A320neo y Boeing 737Max8, modelos que compiten en casi todos los aspectos con el nuevo C919 de Comac",0,19,"/Business & Industrial","2025-04-02 11:56:40","2025-04-02 11:56:40",,,,,,,"Airbus, Boeing",
https://noticiastrabajo.huffingtonpost.es/amp/empleo/oposiciones/boe-publica-oposiciones-mas-1200-plazas-135-convocatorias-muchas-sin-estudios/,"El BOE publica oposiciones con más de 1.200 plazas en 135 convocatorias: muchas sin estudios",https://cache.discoversnoop.com/f19187e1d7fd463a19cf9b4e3b16b74778720cf40731ea03c897540e712e4708-1733140659.jfif,Noticiastrabajo,huffingtonpost.es,"El Boletín Oficial del Estado (BOE), en el punto de acceso general de la Administración del Estado del Gobierno de España, publica 135 convocatorias de ...",0,6,"/Jobs & Education/Jobs/Job Listings","2024-12-02 12:56:27","2024-12-02 12:56:27",,,,,,,,
https://www.aviacionline.com/interceptan-en-polonia-5-toneladas-de-neumaticos-de-aviones-boeing-destinados-a-rusia,"Interceptan en Polonia 5 toneladas de neumáticos de aviones Boeing destinados a Rusia",https://cache.discoversnoop.com/d59d1085a686053dfae6fc04744815bd3251f99a94376415ffdd2608655f3036-1747837916.jfif,Aviacionline,aviacionline.com,"En un operativo que revela nuevas maniobras para eludir las sanciones de la Unión Europea, autoridades aduaneras de Polonia incautaron cinco toneladas...",0,5,"/Autos & Vehicles/Vehicle Parts & Services/Vehicle Parts & Accessories","2025-05-21 11:30:15","2025-05-22 13:48:26",,,,,,,"Boeing, Polonia",
https://amp.elmundo.es/economia/empresas/2024/11/05/6729bf87e4d4d8fd278b458a.html,"Los trabajadores de Boeing aprueban el acuerdo que pone fin a más de siete semanas de huelga",https://cache.discoversnoop.com/6895d368485d465a4e4d5a8eec8a1f94c447384c8a8991a06c3cb63d9f74a468-1730834967.jfif,"El Mundo",elmundo.es,"Los trabajadores de Boeing han puesto fin a más de siete semanas de huelga tras aceptar la propuesta de un nuevo convenio colectivo del fabricante ...",0,12,"/Business & Industrial","2024-11-05 20:28:27","2024-11-05 20:28:27",,,,,,,,
https://www.larazon.es/espana/boe-publica-ley-que-permite-lenguas-cooficiales-supremo-audiencia-nacional_202411146735bded3ebaed0001c8befc.html?outputType=amp,"El BOE publica la Ley que permite el uso de lenguas cooficiales en el Supremo y en la Audiencia Nacional",https://cache.discoversnoop.com/61a155f5643bb1bfb8922b8037baacfa887d6f25ab4e2b2e3ce8707ce62fac5e-1731690033.jfif,"La Razón",larazon.es,"El Boletín Oficial del Estado (BOE) ha publicado en la mañana de este jueves la Ley del Derecho a la Defensa, que entre otras medidas permite el uso de ...",0,11,"/Law & Government/Legal","2024-11-15 17:59:34","2024-11-15 17:59:34",,,,,,,,
https://www.cope.es/actualidad/economia/noticias/boe-confirma-multas-150-euros-empadronado-municipio-vivir-20250207_3090079.amp.html,"El BOE lo confirma: Multas de hasta 150 euros por estar empadronado en un municipio y vivir en otro",https://cache.discoversnoop.com/447bca1d0a85411edecd590eef2699e2381e3a21cf4d804667675246f91750b9-1738951550.jfif,COPE,cope.es,"El BOE confirma multas de hasta 150 euros por estar empadronado en un municipio y vivir en otro",0,11,"/Law & Government/Government","2025-02-07 19:04:41","2025-02-07 19:04:41",,,,,,,"Boletín Oficial del Estado",
https://www.elmundo.es/ciencia-y-salud/ciencia/2024/09/07/66dc1b58fdddff6f748b458f.html,"Aterriza en EEUU la nave Starliner de Boeing sin sus dos astronautas, atrapados en la Estación Espacial Internacional",https://cache.discoversnoop.com/cec3d00d6bf79610d283f549967914da0a920791e8056bf97c8a1dd7f9e452af-1725916571.jfif,"El Mundo",elmundo.es,"La primera misión espacial tripulada de Boeing ha terminado este viernes por la noche con el aterrizaje de una cápsula vacía y dos pilotos varados en el ...",0,3,"/Business & Industrial/Aerospace & Defense/Space Technology","2024-09-09 23:15:09","2024-09-09 23:15:09",,,,,,,,
https://www.preferente.com/noticias-de-transportes/noticias-de-aerolineas/boeing-obligada-a-repatriar-mas-aviones-737-desde-china-343021.html,"Boeing, obligada a repatriar más aviones 737 desde China",https://cache.discoversnoop.com/503adcf8e3522f63edf8c41ac355b856d6238fd40c5cec5bcbd1b9e4744e5096-1745234068.jfif,Preferente.com,preferente.com,"El primer avión de Boeing estaba destinado a Xiamen Air y otros dos estaban esperando retoques para ser entregados",0,11,"/Business & Industrial","2025-04-21 13:13:15","2025-04-21 13:13:15",,,,,,,"Boeing, Turismo, Vuelos",
https://www.elplural.com/autonomias/galicia/mujer-feijoo-recurre-orden-boe-pide-concesion-publica-disfrutar-30-anos-mansion-ilegal_346149102,"La mujer de Feijóo recurre la orden del BOE y pide una concesión pública para disfrutar 30 años de su “mansión ilegal”",https://cache.discoversnoop.com/54daf29507d76f2e49e386be66d1f8fde0afefb052b5faea26f2826fa89a50d3-1739371562.jfif,ElPlural.com,elplural.com,"La mujer de Feijóo recurre la orden del BOE y pide una concesión pública para disfrutar 30 años de su “mansión ilegal”",0,13,/News/Politics,"2025-02-12 15:44:32","2025-02-12 15:44:32",,,,,,,"Alberto Núñez Feijóo",
https://www.infobae.com/teleshow/2025/01/11/marcela-kloosterboer-y-cande-tinelli-criticaron-a-mauro-icardi-y-la-china-suarez-es-vegetariana/?outputType=amp-type,"Marcela Kloosterboer y Cande Tinelli criticaron a Mauro Icardi: “¿Y la China Suárez es vegetariana?",https://cache.discoversnoop.com/88b3b4d871cb3171647e075508cc9af5390b7eb64914b3d2e0511003196b4c2c-1736697053.jfif,Infobae,infobae.com,"La dura reacción de la actriz y la influencer luego de que Ángel de Brito difundiera imágenes del futbolista",0,30,/News,"2025-01-12 10:49:58","2025-01-13 13:10:38",,,,,,,"China Suárez y Wanda Nara",
https://www.vozpopuli.com/actualidad/el-boe-confirma-el-festivo-del-8-de-septiembre-estas-comunidades-podran-hacer-puente.html,"El BOE confirma el festivo del 8 de septiembre: estas comunidades podrán hacer puente",https://cache.discoversnoop.com/ad381569c1c4505f35ebf257af8577bb07b9cfb7734b4600fc4c9ceb1722313f-1756513369.jfif,Vozpópuli,vozpopuli.com,"Estos son los festivos que habrá en septiembre y qué personas podrán hacer puente",0,20,"/Hobbies & Leisure/Special Occasions/Holidays & Seasonal Events","2025-08-30 02:18:52","2025-08-30 03:18:24",,,,,,,"Calendario laboral, puente",
https://www.heraldo.es/noticias/economia/2026/03/26/boe-confirma-ayuda-100euros-propietarios-perros-comunidad-andalucia-1901622.html,"El BOE confirma una ayuda de 100 euros a los propietarios de perros en esta comunidad autónoma",https://cache.discoversnoop.com/33f4aa918443aa7e3bd672cd365b91ba4919de0ca47fafffefee8071c981b856-1774569796.jfif,Heraldo.es,heraldo.es,"Permitirá que en una región española sea posible deducir los gastos veterinarios de aquellos que sean dueños de perros, gatos u otras mascotas.",0,28,"/Pets & Animals/Pets/Dogs","2026-03-27 00:59:41","2026-03-29 06:44:03",,,,1,,,"Declaración de la renta, Mascota, Perro",
https://as.com/actualidad/sociedad/es-oficial-en-el-boe-la-deduccion-de-hasta-el-40-del-irpf-que-podran-solicitar-millones-de-espanoles-en-la-renta-2025-26-f202601-n/,"Es oficial en el BOE: la deducción de hasta el 40% del IRPF que podrán solicitar millones de españoles en la Renta 2025-26",https://cache.discoversnoop.com/4426c5c22953497405ed0d266e2a7c75616acb146710cde302768a5663746d0c-1769610800.jfif,"Diario AS",as.com,"Medidas fiscales que permitirán a propietarios recuperar parte del dinero invertido en reformas destinadas a reducir el consumo energético de sus viviendas.",0,14,"/Finance/Accounting & Auditing/Tax Preparation & Planning","2026-01-28 01:41:50","2026-01-28 15:28:14",,,,,,,"Boletín Oficial del Estado, Impuesto sobre la renta",
