url,title,image,publisher,publisher_url,snippet,score,position,category,firstviewed,lastviewed,is_new,is_headline,is_short,is_showcase,is_video,is_webstory,entities,"social channel"
https://okdiario.com/economia/boe-23-abril-festivo-habra-puente-escolar-estas-comunidades-16561010/amp,"El BOE lo confirma: el 23 de abril es festivo y hay puente escolar en estas comunidades",https://cache.discoversnoop.com/481d74a55bfc34f50f05989edc64a42925d8d6feaba6a01656e5e8b51ea43a33-1776269751.jfif,OkDiario,okdiario.com,"El próximo 23 de abril dos comunidades autónomas de España disfrutarán de un día festivo. Los estudiantes de éstas no tendran clase.",0,17,"/Hobbies & Leisure/Special Occasions/Holidays & Seasonal Events","2026-04-15 18:09:51","2026-04-17 13:48:44",,,,,,,"Día festivo, puente",
https://www.larazon.es/andalucia/cadiz/proceso-rebautizar-puente-mas-antiguo-cadiz-solo-falta-boe-carranza-alberti_202512296951e5afea66eb73532100b7.html?outputType=amp,"Al proceso para rebautizar el puente más antiguo de Cádiz solo le falta el BOE: de Carranza a Alberti",https://cache.discoversnoop.com/bcc3da9f2be03fe061730c6ab12bdc42c4c24b6b5412431ef9cf2ee3d05ed806-1767014764.jfif,"La Razón",larazon.es,"El Ministerio de Transportes tiene ya acordado el cambio de denominación de la infraestructura inaugurada en 1969, a la espera de su publicación en el BOE, en aplicación de la Ley de Memoria Democrática.",0,16,/News,"2025-12-29 14:21:52","2025-12-30 03:01:41",,,,,,,"Puente José León de Carranza",
https://www.lne.es/tv-espectaculos/2025/02/09/boe-confirma-adios-cambio-hora-114128147.amp.html,"El BOE lo confirma: adiós el cambio de hora de 2025, que será distinto al de 2024 y así nos afecta",https://cache.discoversnoop.com/19c401c1e8f9473f4ab82e6f20ac31feccd37bf7ba6b52e52894c7378bb3c2c0-1739131075.jfif,"La Nueva España",lne.es," El Parlamento Europeo votó a favor de eliminar el cambio de hora en la Unión Europea",0,11,"/Reference/General Reference/Time & Calendars","2025-02-09 20:56:58","2025-02-09 22:11:20",,,,,,,"Horario de verano, Parlamento Europeo",
https://www.preferente.com/noticias-de-transportes/noticias-de-aerolineas/un-boeing-737-de-ryanair-se-desvia-de-urgencia-a-malaga-338033.html,"Un Boeing 737 de Ryanair se desvía de urgencia a Málaga",https://cache.discoversnoop.com/99281e8aaa653271b7d869f71df7f449460523cfe63e0cec88c2b3994d645b6e-1721092179.jfif,Preferente.com,preferente.com,"Un Boeing 737 de Ryanair que cubría la ruta entre Milán y Marrakech ha tenido que aterrizar en Málaga por un pasajero conflictivo.",0,9,"/Travel/Air Travel","2024-07-16 03:08:32","2024-07-16 05:03:57",,,,,,,,
https://www.lasprovincias.es/sociedad/boe-regala-ordenadores-1000-euros-ciertos-trabajadores-20240526164000-nt_amp.html,"El BOE 'regala' ordenadores de 1.000 euros para ciertos trabajadores",https://cache.discoversnoop.com/aaedba0388105c7998531a6012721a35a2a6885cd4652877dc90ba4196a494d6-1716989768.jfif,"Las Provincias",lasprovincias.es,"La ayuda se enmarca en proporcionar «herramientas de seguridad, movilidad y colaboración en el puesto de trabajo con el fin de potenciar su productividad»",0,7,"/Finance/Grants, Scholarships & Financial Aid","2024-05-26 21:54:24","2024-05-26 22:06:03",,,,,,,,
https://www.eleconomista.es/empleo/noticias/13593812/10/25/aprobado-por-el-boe-2025-salen-90-convocatorias-de-oposiciones-y-miles-de-plazas-para-ser-funcionario-en-la-administracion-autonomica-local-o-estatal.html,"Aprobado por el BOE 2025: salen 90 convocatorias de oposiciones y miles de plazas para ser funcionario en la Administración autonómica, local o estatal",https://cache.discoversnoop.com/00acfda04c8a4eda6a2c5ed6e3671f1320c340048e6075353600a8a1bcdf5fa6-1760566407.jfif,"El Economista",eleconomista.es,"El Boletín Oficial del Estado (BOE) ha publicado en este mes de octubre 90 nuevas convocatorias de oposiciones que suponen miles de plazas para trabajar como funcionario en distintas Administraciones, que pueden ser a nivel estatal, autonómico o local.",0,11,"/Jobs & Education/Jobs/Job Listings","2025-10-16 00:10:08","2025-10-16 18:33:24",,,,,,,"Funcionario público, Oposición, Personal laboral",
https://www.larazon.es/economia/bombona-butano-corta-sus-caidas-encarece-385-este-martes-1593-euros_2024091666e7e04fb3741e0001e7642c.html?outputType=amp,"El BOE lo confirma: el precio de la bombona de butano sube desde este martes y este es su nuevo precio",https://cache.discoversnoop.com/f79a5bda74656ee71befb03436999dc3026ddeadfc7d604ee770a98b6cb4edb4-1726486315.jfif,"La Razón",larazon.es,"El precio máximo de venta al público de la bombona de butano se encarecerá un 3,85% a partir de este martes, hasta los 15,93 euros, con lo que cortará así...",0,9,"/Business & Industrial/Energy & Utilities/Oil & Gas","2024-09-16 13:30:53","2024-09-16 15:35:13",,,,,,,,
https://www.elnortedecastilla.es/valladolid/provincia/adjudicada-redaccion-proyecto-transformar-n601-olmedo-boecillo-20251211130541-nt_amp.html,"Adjudicada la redacción del proyecto para transformar la N-601 entre Olmedo y Boecillo",https://cache.discoversnoop.com/96213c2e377049c87afff2c9b2b0b957c038870b87cec379de911984a9f65ea2-1765491364.jfif,"El Norte de Castilla",elnortedecastilla.es,"Transportes prevé invertir 101,7 millones en obras para convertir el tramo en carretera 2+1, eliminar las peligrosas travesías de Olmedo y Mojados y prolongar la autovía",0,14,"/Business & Industrial/Construction & Maintenance","2025-12-11 23:12:22","2025-12-12 19:59:14",,,,,,,"Autovía, Autovía del Duero",
https://andaluciaorienta.net/boe-670-plazas-de-empleo-publico-ayuntamientos,"El BOE publica la convocatoria de 670 plazas de Empleo Público (acceso libre), para Ayuntamientos",https://cache.discoversnoop.com/5f0c4b197680eb4b6eb0715d5da4aad3122709ea96ce31fbd7385f6eb026c0b9-1735496855.jfif,"Andalucia Orienta",andaluciaorienta.net,"Empleo Público BOE. El Boletín Oficial del Estado publica convocatorias para cubrir un total de 670 plazas de empleo, en toda España.",0,11,"/Jobs & Education/Jobs/Job Listings","2024-12-29 19:26:13","2024-12-30 22:28:39",,,,,,,,
https://andaluciaorienta.net/751-plazas-de-empleo-publico-andalucia,"751 plazas de Empleo Público en Ayuntamientos de Andalucía (pendientes de publicación en el BOE)",https://cache.discoversnoop.com/46eccdd72a742a97ffcaa321c7f03a78d40ba0fc6cb44a5bd19308439c5bce6f-1760317042.jfif,"Andalucia Orienta",andaluciaorienta.net,"751 plazas de Empleo Público en Andalucía: Ayuntamientos y Diputaciones (BOP Sevilla, Málaga, Jaén, Huelva, Granada, Córdoba, Cádiz, Almería).",0,10,"/Jobs & Education/Jobs/Job Listings","2025-10-13 02:53:43","2025-10-19 11:22:12",,,,,,,"Andalucía, Empleo público",
https://www.larazon.es/internacional/lufthansa-obligada-volar-sus-boeing-747-trayectos-2000-kilometros-pasajeros-escasez-combustible-p7m_20250131679d1306797cbb00013cdf42.html?outputType=amp,"Lufthansa, obligada a volar sus Boeing 747 en trayectos de 2.000 kilómetros sin pasajeros ante la escasez de combustible",https://cache.discoversnoop.com/1b0b8acbc547a8e750737a9a8fc83cb9f24e5ba2950d476e65ea912140e15875-1738387810.jfif,"La Razón",larazon.es,"El aeropuerto de Johannesburgo reconoce que solo puede garantizar el suministro de combustible hasta el 2 de febrero",0,8,"/Travel/Air Travel","2025-02-01 06:28:36","2025-02-02 19:10:41",,,,,,,"Aviones, Boeing, Lufthansa",
https://www.ultimahora.es/xaloc/dudas-respuestas/2025/02/27/2334479/boe-confirma-cambio-horario-verano-adelanta-tiene-fecha-oficial.html,"El BOE lo confirma: El cambio de horario de verano tiene fecha oficial y se adelanta el reloj",https://cache.discoversnoop.com/6a4eb4c0925ee60a602abd37ed45438f22114a6a232bf0809f01e5df0b378c55-1740694692.jfif,"Ultima Hora",ultimahora.es,"La adaptación al horario estival se producirá en la madrugada del 29 al 30 de marzo. Como cada año, los ciudadanos de España deberán prepararse para el primer cambio de hora, que sucede finales de marzo. Sin embargo, esta vez el Boletín Oficial del Estado ha confirmado con antelación la fe",0,7,"/Reference/General Reference/Time & Calendars","2025-02-27 23:16:48","2025-02-28 07:13:21",,,,1,,,"Horario de verano, Huso horario",
https://www.heraldo.es/noticias/economia/2026/04/16/boe-confirma-ayuda-100euros-propietarios-perros-comunidad-andalucia-1901622.amp.html,"El BOE confirma una ayuda de 100 euros a los propietarios de perros en esta comunidad",https://cache.discoversnoop.com/b76873f667e4043e55159065ae47f5c5e1313082afb8b4a9a4def6b4f03cb94c-1776425195.jfif,heraldo.es,heraldo.es,"Permitirá que en una región española sea posible deducir los gastos veterinarios de aquellos que sean dueños de perros, gatos u otras mascotas.",0,10,"/Pets & Animals/Pets/Dogs","2026-04-17 09:50:15","2026-04-17 18:16:24",1,,,,,,"Declaración de la renta, Mascota, Perro",
https://www.preferente.com/noticias-de-transportes/noticias-de-aerolineas/descenso-a-alta-velocidad-de-un-boeing-787-en-gran-canaria-345245.html,"Descenso a alta velocidad de un Boeing 787 en Gran Canaria",https://cache.discoversnoop.com/459ba1b6e4ffe18104bf980953ccf110d62a1f897481e43b9ef611b9919e530e-1756754345.jfif,Preferente.com,preferente.com,"Emergencia médica a bordo de un Boeing 787 Dreamliner de Tui Fly procedente de Ámsterdam con destino Gran Canaria",0,9,"/Travel/Air Travel","2025-09-01 21:17:06","2025-09-03 18:25:57",,,,,,,"Boeing, Boeing 787",
https://okdiario.com/curiosidades/boe-confirma-puente-que-llega-espana-2026-ya-oficial-3-dias-fiesta-15967173/amp,"El BOE confirma el puente que llega a España en 2026 y ya es oficial: 3 días de fiesta",https://cache.discoversnoop.com/127530cb5e162498c5d239b9e1d7b83e5edcf02a2ad46324661b02ec0e402240-1766304035.jfif,OkDiario,okdiario.com,"El BOE ha confirmado oficialmente los festivos para 2026 en España, incluyendo un puente de tres días para descansar.",0,11,"/Hobbies & Leisure/Special Occasions/Holidays & Seasonal Events","2025-12-21 08:58:08","2025-12-23 19:20:10",,,,,,,puente,
https://www.infobae.com/espana/viajes/2025/02/27/un-avion-privado-entra-en-la-pista-de-un-aeropuerto-sin-autorizacion-y-un-boeing-que-aterrizaba-tuvo-que-dar-la-vuelta-para-evitar-la-colision/?outputType=amp-type,"Un avión privado entra en la pista de un aeropuerto “sin autorización” y un Boeing que aterrizaba tuvo que dar la vuelta para evitar la colisión",https://cache.discoversnoop.com/41005c6288cfee776565020e35f6134cbfa9f24ca90a9157572c8334cae33bcd-1740729294.jfif,Infobae,infobae.com,"El incidente ocurrió el pasado martes en Chicago, en uno de los aeropuertos más transitados de los Estados Unidos",0,11,"/Sensitive Subjects","2025-02-28 04:53:51","2025-03-02 05:32:21",,,,,,,"Aviones, Boeing, Pista de aterrizaje",
https://www.cronista.com/infotechnology/actualidad/despega-el-avion-que-rompe-la-formula-de-boeing-no-tiene-precedentes-y-cambia-los-vuelos-para-siempre/,"Despega el avión que rompe la fórmula de Boeing: no tiene precedentes y cambia los vuelos para siempre",https://cache.discoversnoop.com/f9e64f6129ac3b3426e5238eac3ba349d0e3602f708b8e17bfa6c5d11748e1e7-1767407203.jfif,"El Cronista",cronista.com,"Outbound Aerospace avanza con su aeroplano “blended wing” Olympic: prototipo STeVe vuela con éxito en 2025, prometiendo 50% menos combustible que Boeing y cabinas ultraespaciosas para 250 pasajeros en la década de 2030.",0,8,"/Business & Industrial","2026-01-02 15:28:37","2026-01-03 07:12:19",,,,,,,"Avión, Boeing, Vuelo",
https://madridinforma.eldiario.es/el-boe-certifica-una-importante-rebaja-del-butano-que-muchos-hogares-llevaban-tiempo-esperando/,"El BOE certifica una importante rebaja del butano que muchos hogares llevaban tiempo esperando",https://cache.discoversnoop.com/7b4c730c67840cf3f33e48126afbba99c8829a0c96776682d8d94fe68f18295d-1766057481.jfif,Madridinforma,eldiario.es,"El BOE confirma la bajada del butano: la bombona de 12 kilos baja a 15,46 euros y alivia el gasto energético doméstico.",0,12,"/Business & Industrial/Energy & Utilities/Oil & Gas","2025-12-18 12:27:12","2025-12-19 20:35:02",,,,,,,Butano,
https://andaluciaorienta.net/780-plazas-de-empleo-publico-boe-andalucia,"780 plazas de Empleo Público en Ayuntamientos de Andalucía (pendientes de publicación en el BOE)",https://cache.discoversnoop.com/ff4df6c9fe7dc8ea114095b98d6d6b07b58ca53c1396b381327eaa44c46ae08d-1760912989.jfif,"Andalucia Orienta",andaluciaorienta.net,"780 plazas de Empleo Público en Andalucía: Ayuntamientos y Diputaciones (BOP Sevilla, Málaga, Jaén, Huelva, Granada, Córdoba, Cádiz, Almería).",0,13,"/Jobs & Education/Jobs/Job Listings","2025-10-20 00:24:22","2025-10-21 11:24:36",,,,,,,"Empleo público",
https://www.xataka.com/transporte/boeing-anuncia-despido-17-000-empleados-gigante-estadounidense-se-tambalea-medio-crisis-historica/amp,"Boeing anuncia el despido de 17.000 empleados. El gigante estadounidense se tambalea en medio de una crisis histórica",https://cache.discoversnoop.com/1c0219ae6b2e85f480b4219eb242dd93f8f862e1bead3ffb924244503e3bbbd3-1728692461.jfif,Xataka,xataka.com,"Boeing no se encuentra en su mejor momento. El gigante aeroespacial estadounidense ha anunciado que recortará el 17% de su plantilla, lo que se traduce en.",0,12,"/Business & Industrial","2024-10-11 19:18:10","2024-10-13 13:04:39",,,,,,,,
https://www.larazon.es/sociedad/boe-confirma-3-noviembre-sera-festivo-estas-comunidades-autonomas-p7m_2025102869010bb64e775547a9058b45.html,"El BOE lo confirma: el 3 de noviembre será festivo en estas comunidades autónomas",https://cache.discoversnoop.com/c64d97e41f1bcaa834fd0d7782f727927d6f7f85cc752a8a444b784be85c9355-1761822203.jfif,"La Razón",larazon.es,"Muchos españoles se preguntan si habrá puente este año, al caer el Día de Todos los Santos en sábado",0,8,"/Hobbies & Leisure/Special Occasions/Holidays & Seasonal Events","2025-10-30 11:59:43","2025-10-30 14:05:11",,,,1,,,"Día festivo, Noviembre",
https://elbierzo.eldiario.es/ponferrada/ponferrada-proyecta-primera-via-ferrata-bierzo-puentes-tibetanos-fragas-rio-boeza_1_12817446.amp.html,"Ponferrada proyecta la primera vía ferrata de El Bierzo con dos puentes tibetanos en Las Fragas del río Boeza",https://cache.discoversnoop.com/00caadd507ba53dac8a40a5abed9ed9ea855d4a1528a3ed38345c555c6b7ae5c-1764864805.jfif,elDiario.es,eldiario.es,"La Confederación somete a información pública la solicitud del Ayuntamiento en una zona habitual de escalada",0,7,"/Sports/Extreme Sports","2025-12-04 17:10:33","2025-12-05 08:01:51",,,,,,,"El Bierzo, Ponferrada, Vía ferrata",
https://www.telecinco.es/noticias/economia/consumo/20251214/boe-confirma-subida-precio-tabaco-nuevas-tarifas_18_017817462.html,"El BOE confirma la subida del precio del tabaco en 2026: las nuevas tarifas",https://cache.discoversnoop.com/702123e5967bd9ce6d5379c0e730cee63d0f0dec4025fee622a24d189630fcf7-1765774424.jfif,Telecinco,telecinco.es,"El mercado del tabaco volverá a ajustarse al alza en España el próximo año. La última resolución publicada en el Boletín Oficial del Estado confirma",0,11,"/Shopping/Tobacco Products","2025-12-14 22:41:38","2025-12-15 20:07:18",,,,1,,,"Cigarrillo, Precio",
https://www.heraldo.es/noticias/economia/2026/01/05/miles-trabajadores-notaran-nomina-nueva-deduccion-hasta-340-euros-2026-1881466.amp.html,"Miles de trabajadores notarán en 2026 una nueva deducción de hasta 340 euros en la nómina tras publicarse en el BOE",https://cache.discoversnoop.com/0ce44abc14b0ee202e319061587c31111390c15ac87279f7e3e5bbbe54bbddd7-1767654987.jfif,heraldo.es,heraldo.es,"En 2026, al hacer la Renta de 2025, muchos asalariados con sueldos bajos podrán aplicar una nueva deducción en el IRPF de hasta 340 euros.",0,17,"/Finance/Accounting & Auditing/Tax Preparation & Planning","2026-01-06 00:13:28","2026-01-07 17:12:45",,,,,,,"Impuesto sobre la renta, Nómina",
https://www.larazon.es/economia/trump-vuelve-dar-alas-china-comac-competir-airbus-boeing-permitir-americana-que-reanude-suministro-motores-avion-c919_20250710686e591a3c6d9a1f9470fdc2.html?outputType=amp,"Trump vuelve a dar alas a la china Comac para competir con Airbus y Boeing al permitir a la americana GE que reanude el suministro de motores para el avión C919",https://cache.discoversnoop.com/54270d090f640e165d91035a271160e06ba2d63cb5e53a467c6fd8b4749f67d8-1752164532.jfif,"La Razón",larazon.es,"La administración estadounidense había prohibido la venta de los propulsores en el marco de las tensiones comerciales por los aranceles",0,13,"/Business & Industrial","2025-07-10 18:19:06","2025-07-11 02:29:19",,,,,,,"Airbus, Boeing, Donald Trump",
https://www.abc.es/espana/aragon/pilar-jorge-jorge-pilar-precampana-aragonesa-empieza-20251217140657-nt.html,"La precampaña aragonesa empieza 'calentita': la ministra hace campaña antes de que su cese sea oficial en el BOE pero denuncia a Azcón",https://cache.discoversnoop.com/ca42e4e780ac2d041ee804d37173d117521a1388fbb06b7a111af6311a0fa2e4-1766020789.jfif,ABC,abc.es,"En su perfil en redes aún figura como ministra portavoz, su cese no se ha publicado en el BOE, pero justo el PSOE aragonés interpone dos denuncias en 24 horas ante la Junta Electoral porque el presidente maño «está utilizando su acción de gobierno para ganarse votos»",0,3,/News/Politics,"2025-12-18 02:15:51","2025-12-18 18:20:41",,,,,,,"Gobierno de España, Jorge Azcón, Pilar Alegría",
https://noticiastrabajo.huffingtonpost.es/amp/empleo/oposiciones/el-boe-confirma-nuevas-convocatorias-de-oposiciones-con-miles-de-plazas-para-ser-funcionario-de-carrera/,"El BOE confirma nuevas convocatorias de oposiciones con miles de plazas para ser funcionario de carrera",https://cache.discoversnoop.com/317485fea17f3946eb75f2ab7cbd28b104b2032815eff9022a6d140818fb7e4a-1759832190.jfif,Noticiastrabajo,huffingtonpost.es,"En algunas de ellas no hace falta tener estudios superiores e incluso hay plazas donde solo piden el certificado de escolaridad.",0,12,"/Jobs & Education/Jobs/Job Listings","2025-10-07 12:13:16","2025-10-07 22:59:56",,,,,,,"Empleo público, Oposición",
https://www.20minutos.es/lainformacion/economia-y-finanzas/seguridad-social-cambio-nomina-95-euros-menos-salario-2026_6513290_0.html,"Confirmado por el BOE: la nueva reducción en las nóminas que entrará en vigor el 1 de enero de hasta 95 euros menos",https://cache.discoversnoop.com/e369ff1f92d7628388cd772c756b3b236f21dbac5646a6577863ab8da155c75c-1761158518.jfif,lainformacion.com,20minutos.es,"Según ha confirmado el BOE, el descuento del Mecanismo de Equidad Intergeneracional afectará a los trabajadores para reforzar la hucha de las pensiones.",0,15,"/Finance/Financial Planning & Management/Retirement & Pension","2025-10-22 17:18:10","2025-10-24 22:01:46",,,,1,,,"Nómina, Seguridad Social",
https://galaxiamilitar.es/pratt-whitney-revelo-accidentalmente-el-diseno-futuro-del-caza-boeing-f-47/,"¿Pratt & Whitney reveló accidentalmente el diseño futuro del caza Boeing F-47?",https://cache.discoversnoop.com/1c84d561325e6b1c02329a951319fe7448cb5fbea274b71bcca73e1bffe1032a-1771667305.jfif,"Galaxia Militar",galaxiamilitar.es,"Pratt & Whitney compartió un video sobre el desarrollo de su motor de ciclo adaptativo XA103, diseñado para cumplir con los requisitos del programa NGAP de la Fuerza Aérea de EE. UU., que a su vez respalda la iniciativa NGAD más amplia bajo la cual el caza Boeing F-47 fue seleccionado como",0,9,"/Business & Industrial","2026-02-21 02:00:48","2026-02-21 04:42:23",,,,,,,"Avión, Boeing",
https://amp.lasexta.com/programas/al-rojo-vivo/eduardo-saldana-bloqueo-china-boeing-golpe-bastante-duro-industria-aeronautica-eeuu_2025041567fe2fa547c02c000146b157.html,"Eduardo Saldaña, tras el bloqueo de China a Boeing: ""Es un golpe bastante duro para la industria aeronáutica de EEUU""",https://cache.discoversnoop.com/68058a0eae8f9d7157e5bdafd6cf990176382d2265cc7bc57a460f6108a394d3-1744782417.jfif,LaSexta,lasexta.com,"El codirector de 'El Orden Mundial' valora en este vídeo el último movimiento de China en su guerra comercial con EEUU: ha ordenado a sus aerolíneas no aceptar entregas de aviones Boeing. ",0,10,"/Business & Industrial","2025-04-16 07:45:24","2025-04-16 09:03:55",,,,,,,"Boeing, Industria aeronáutica",
https://www.3cat.cat/3cat/el-boe-publica-els-canvis-en-les-deduccions-fiscals-a-la-declaracio-de-la-renda/video/6316990/,"Telenotícies - El BOE publica els canvis en les deduccions fiscals a la declaració de la renda",https://cache.discoversnoop.com/2dde0265e62f3a686b1f1ae56b75d6b13c64d29f54d3140bc1ab3db4680afbcc-1735089052.jfif,3Cat,3cat.cat,"El Butlletí Oficial de l'Estat publica els detalls del paquet fiscal aprovat pel Consell de Ministres. Els canvis afecten les obres a habitatges que...",0,7,"/News/Business News","2024-12-25 02:09:52","2024-12-25 19:07:49",,,,,,,,
https://vibes.okdiario.com/consumo/nuevo-precio-del-butano-para-enero-de-2025-lo-confirma-el-boe/amp/,"Nuevo precio del butano para enero de 2025: lo confirma el BOE",https://cache.discoversnoop.com/a15267fad63eb0b0ef953aecfa8b7012eabbe7601c4c9536699efbfbc4703508-1736483918.jfif,"VIBES Noticias",okdiario.com,,0,13,"/Business & Industrial/Energy & Utilities/Oil & Gas","2025-01-10 05:37:43","2025-01-10 09:12:38",,,,,,,"Butano, Gas natural y Hidrocarburos",
https://www.elconfidencial.com/amp/empresas/2025-08-01/vueling-boeing-y-dejara-de-operar-con-airbus_4184557/,"Vueling recibirá 50 aviones Boeing y dejará de operar con Airbus",https://cache.discoversnoop.com/e2bb835698cc321f3971b1df85030417b305d8d0aa50851fa5cb869a74e718cf-1754087599.jfif,"El Confidencial",elconfidencial.com,"La línea aérea ha explicado que esta asignación ""refleja la confianza del grupo en los sólidos resultados de la compañía y apoyan su desarrollo a largo plazo""",0,20,"/Travel/Air Travel","2025-08-02 00:31:12","2025-08-02 04:48:28",,,,,,,"Airbus, Boeing, Vueling",
https://andaluciaorienta.net/boe-855-plazas-empleo-publico-ayuntamientos,"El BOE publica la convocatoria de 855 plazas de Empleo Público (acceso libre), para Ayuntamientos",https://cache.discoversnoop.com/4719e711a72f79c5fdb88d6b2b225191b7af7af0613f25fb47f1a4a1c6beae22-1726443561.jfif,"Andalucia Orienta",andaluciaorienta.net,"Empleo Público BOE. El Boletín Oficial del Estado publica convocatorias para cubrir un total de 855 plazas de empleo, en toda España.",0,10,"/Jobs & Education/Jobs/Job Listings","2024-09-16 01:38:44","2024-09-17 15:50:00",,,,,,,,
https://okdiario.com/economia/giro-cambio-hora-motivo-que-catalanes-no-quieren-hacer-lo-que-boe-ya-confirmado-15551253/amp,"Giro en el cambio de hora: el motivo por el que los catalanes no quieren hacer lo que el BOE ya ha confirmado",https://cache.discoversnoop.com/6a988ae53106cf26f128d104a653a977a8d37f55f03a53e3cfd4c9734fd50d6b-1759998304.jfif,OkDiario,okdiario.com,"El independentismo catalán quiere cambiar el huso horario de los catalanes para adaptarse a Reino Unido o Canarias. Así será el cambio de hora",0,22,"/Reference/General Reference/Time & Calendars","2025-10-09 10:21:25","2025-10-09 12:12:22",,,,,,,"Cataluña, Catalán, Horario de verano",
https://noticiastrabajo.huffingtonpost.es/amp/empleo/oposiciones/el-boe-avisa-de-las-ultimas-oposiciones-del-ano-y-que-son-faciles-de-aprobar-14328-plazas/,"El BOE avisa de las últimas oposiciones del año y que son fáciles de aprobar: 14.328 plazas",https://cache.discoversnoop.com/b47ffe405cdd4f6e80eaa902618b6abce5ed7aaf4fc7c665e5a88d74ac95a317-1735679238.jfif,Noticiastrabajo,huffingtonpost.es,"El Boletín Oficial del Estado (BOE) ha publicado las últimas convocatorias de oposiciones del año 2024 y a las que es posible inscribirse durante las...",0,8,"/Jobs & Education/Education/Standardized & Admissions Tests","2024-12-31 22:05:52","2024-12-31 23:30:54",,,,,,,,
https://www.20minutos.es/lainformacion/economia-y-finanzas/seguridad-social-espana-equidad-nominas-95-euros-menos-reduccion-salario-mei-2026_6513290_0.html,"Confirmado por el BOE: la nueva reducción en las nóminas que entrará en vigor el 1 de enero de hasta 95 euros menos",https://cache.discoversnoop.com/c5078094c4dad58a5beb7f145f7c9d0fd0af950f728c0ec33c460e3799561fbe-1760738430.jfif,20Minutos,20minutos.es,"Según ha confirmado el BOE, el descuento del Mecanismo de Equidad Intergeneracional afectará a los trabajadores para reforzar la hucha de las pensiones.",0,13,"/Finance/Financial Planning & Management/Retirement & Pension","2025-10-17 23:57:21","2025-10-18 14:39:05",,,,,,,"Nómina, Seguridad Social",
https://amp.elmundo.es/loc/famosos/2025/07/03/686546c0e9cf4a91348b45b7.html,"Francisco de Borbón se entera por el BOE que su hermana Olivia ha solicitado el Ducado de Sevilla",https://cache.discoversnoop.com/521004013a9c9ac2f63e3c2a34c584d1e69a259bcaf2fb77bd004583cc4f6c6c-1751589636.jfif,"El Mundo",elmundo.es,"El Boletín Oficial del Estado, acaba de publicar la solicitud del Ducado de Sevilla con Grandeza de España por parte de Olivia de Borbón Von Hardenberg (51). Un título que le corre",0,12,"/Law & Government/Government","2025-07-04 02:38:51","2025-07-04 10:23:19",,,,,,,"Ducado de Sevilla, Francisco de Borbón y Escasany",
https://www.hoy.es/economia/hacienda-anuncia-cambio-historico-boe-facturacion-digital-20260401085224-nt_amp.html,"Hacienda anuncia un cambio histórico: el BOE pone fin a las facturas tradicionales a partir del 20 de abril",https://cache.discoversnoop.com/9894472b64b105c005b0a154cbedb395ee0f635b9ced2e36d4a160067d8b7e92-1775073308.jfif,Hoy,hoy.es,"El BOE ha publicado un decreto por el que cambia el sistema de facturación de los negocios",0,10,"/Finance/Accounting & Auditing/Billing & Invoicing","2026-04-01 21:49:55","2026-04-02 08:39:46",,,,,,,"Boletín Oficial del Estado",
