url,title,image,publisher,publisher_url,snippet,score,position,category,firstviewed,lastviewed,is_new,is_headline,is_short,is_showcase,is_video,is_webstory,entities,"social channel"
https://www.elnacional.cat/oneconomia/ca/economia/boe-avisa-prohibit-installar-maquina-aire-condicionat-facana_1475186_102.html,"El BOE avisa: prohibit instal·lar la màquina de l'aire condicionat a la façana",https://cache.discoversnoop.com/f7b8778b9c8844b8c4b49d6849fcd783df4632b4edaeffd670d775aba9388416-1756708095.jfif,"El Nacional.cat",elnacional.cat,"Experts desgranen les claus i excepcions de la nova llei que impacta a milions de comunitats de propietaris",0.2,11,"/Home & Garden/HVAC & Climate Control","2025-09-01 08:24:42","2025-09-03 08:31:51",,,,,,,"Aire acondicionat, Aire condicionat, HVAC",
https://www.mundodeportivo.com/actualidad/20250809/1002512253/oficial-espana-cambia-ley-boe-gran-grupo-trabajadores-disfrutara-ano-rebaja-irpf-finanzas-dct.html?facet=amp,"Ya es oficial: España cambia la ley del BOE y este gran grupo de trabajadores disfrutará, desde este año, de una rebaja en el IRPF",https://cache.discoversnoop.com/8a68be35a09c15df08983bcfaaf859d847e7761deb0006706de9fc23257f51f8-1754859118.jfif,"Mundo Deportivo",mundodeportivo.com,"En medio de un panorama económico incierto, el Gobierno ha decidido mover ficha y poner en marcha nuevas medidas para echar una mano a quienes más lo necesitan. La",0.2,8,"/Law & Government/Legal","2025-08-10 22:48:12","2025-08-11 14:31:27",,,,,,,"Boletín Oficial del Estado",
https://www.cronista.com/infotechnology/actualidad/despega-el-avion-que-rompe-la-formula-de-boeing-no-tiene-precedentes-y-cambia-los-vuelos-para-siempre/?outputType=amp-type,"Despega el avión que rompe la fórmula de Boeing: no tiene precedentes y cambia los vuelos para siempre",https://cache.discoversnoop.com/0c4592aca5cb29dbf9b6573df8a49a9f8ed5abbb84bd011abd84843717099ea5-1767389207.jfif,"El Cronista",cronista.com,"Outbound Aerospace avanza con su aeroplano “blended wing” Olympic: prototipo STeVe vuela con éxito en 2025, prometiendo 50% menos combustible que Boeing y cabinas ultraespaciosas para 250 pasajeros en la década de 2030.",0.2,9,"/Business & Industrial","2026-01-02 13:26:13","2026-01-05 07:43:16",,,,,,,"Avión, Boeing, Fuselaje integrado, Vuelo",
https://andaluciainforma.eldiario.es/actualidad/el-boe-publica-el-calendario-laboral-de-2025-encuentra-los-festivos-y-puentes-segun-tu-comunidad-autonoma/,"El BOE publica el calendario laboral de 2025: encuentra los festivos y puentes, según tu comunidad autónoma",https://cache.discoversnoop.com/d4fa1ecac0f0c49c7b00098b6b45a2118315f722544d90b1f477fd1855e1ddbe-1732156726.jfif,Andaluciainforma,eldiario.es,"El BOE ha publicado el calendario laboral del año 2025, donde figuran los festivos comunes en el país, y repartidos por comunidad autónoma.",0.2,7,"/Reference/General Reference/Time & Calendars","2024-11-21 03:38:03","2024-11-21 10:35:57",,,,,,,,
https://okdiario.com/economia/boe-lo-confirma-23-abril-festivo-hay-puente-escolar-estas-comunidades-16561010/amp,"El BOE lo confirma: el 23 de abril es festivo y hay puente escolar en estas comunidades",https://cache.discoversnoop.com/873b3a060175d8966a2c42c38f90a43b0055e4074b5a1768a27db4e548ad78af-1775705327.jfif,OkDiario,okdiario.com,"El próximo 23 de abril dos comunidades autónomas de España disfrutarán de un día festivo. Los estudiantes de éstas no tendran clase.",0.2,9,"/Hobbies & Leisure/Special Occasions/Holidays & Seasonal Events","2026-04-08 20:00:39","2026-04-09 17:48:49",,,,,,,"Calendario laboral, Día festivo, puente",
https://okdiario.com/economia/boe-lo-confirma-23-abril-festivo-hay-puente-escolar-estas-comunidades-16561010,"El BOE lo confirma: el 23 de abril es festivo y hay puente escolar en estas comunidades",https://cache.discoversnoop.com/bf3d428495fee0b5692b800596be60861e51dc307051d3d3b29f481f84f28f9d-1775694383.jfif,Okdiario,okdiario.com,"El próximo 23 de abril dos comunidades autónomas de España disfrutarán de un día festivo. Los estudiantes de éstas no tendran clase.",0.1,10,"/Hobbies & Leisure/Special Occasions/Holidays & Seasonal Events","2026-04-09 02:22:27","2026-04-09 08:28:07",,,,1,,,"Día festivo, puente",
https://www.informacion.es/finanzas-personales/2025/01/27/multa-boe-empadronados-otro-municipio-dv-113745431.amp.html,"Confirmado por el BOE: esta es la multa para quienes están empadronados en un sitio y viven en otro",https://cache.discoversnoop.com/3ea348d3d1c2ab72ab469e7afcf9095d84b70360c6742a9e9b2ad381f99031d7-1738070298.jfif,INFORMACION,informacion.es,"Estar inscrito en el padrón de otro municipio diferente al que se resides puede conllevar sanciones económicas",0.1,4,"/Law & Government/Legal","2025-01-28 14:17:03","2025-01-30 09:52:55",,,,,,,"Registro de residentes, Sanción",
https://www.laopiniondemurcia.es/buzzeando/2025/05/19/buenas-noticias-region-murcia-boe-dv-117554416.amp.html,"Buenas noticias para la Región de Murcia: recupera este festivo en menos de un mes según el BOE",https://cache.discoversnoop.com/2b4c08f7a0718267fa5561715461862c3a1c6378103e80e0f1261b4b2b554178-1747658452.jfif,"La Opinión de Murcia",laopiniondemurcia.es,"Este año se recupera el festivo, que hará puente con el fin de semana ",0.1,8,/News,"2025-05-19 14:39:23","2025-05-22 11:11:58",,,,,,,"Región de Murcia",
https://andaluciaorienta.net/767-empleo-publico-ayuntamientos-de-andalucia,"767 plazas de Empleo Público en Ayuntamientos de Andalucía (pendientes de publicación en el BOE)",https://cache.discoversnoop.com/9e24f2ad6fdddc774d104ca5ab2069d68e4759d6d331c57c4f39e1daaae175a6-1758482280.jfif,"Andalucia Orienta",andaluciaorienta.net,"767 plazas de Empleo Público en Andalucía: Ayuntamientos y Diputaciones (BOP Sevilla, Málaga, Jaén, Huelva, Granada, Córdoba, Cádiz, Almería).",0.1,12,"/Jobs & Education/Jobs/Job Listings","2025-09-21 21:15:40","2025-09-23 02:47:57",,,,,,,"Andalucía, Empleo público, Personal laboral",
https://noticiastrabajo.huffingtonpost.es/amp/economia/trabajadores-notaran-nomina-nueva-deduccion-hasta-340-euros-aprobada-boe-2026/,"Miles de trabajadores verán en 2026 una nueva deducción en la nómina de hasta 340 euros tras la aprobación en el BOE",https://cache.discoversnoop.com/df309bbadda96f96608b7a9e8a00efc02120e5b1090915a049649c61060f15df-1766420011.jfif,Noticiastrabajo,huffingtonpost.es,"Aquellos trabajadores que cobren menos de 18.276 euros al año podrán acceder a una nueva deducción en el IRPF de hasta 340 euros, tal y como recoge la Ley 5/2025 publicada en el Boletín Oficial del Estado.",0.1,11,"/Finance/Accounting & Auditing/Tax Preparation & Planning","2025-12-22 17:10:27","2025-12-29 13:47:53",,,,,,,"Impuesto sobre la renta, Nómina",
https://www.elespanol.com/sociedad/20260107/boe-hace-oficial-partir-enero-nomina-menor-aumento-impuesto/1003744080165_0.amp.html,"El BOE lo hace oficial: a partir de enero de 2026, tu nómina será menor por el aumento de este impuesto",https://cache.discoversnoop.com/7ecd4e8ca68f3426a27907e7a05157b4e2079c0b15c26abe0eafa88e7b74dae4-1767931195.jfif,"El Español",elespanol.com,"El aumento del MEI reducir&aacute; el salario neto de todos los cotizantes, sum&aacute;ndose a otras cargas y aumentando la presi&oacute;n financiera.M&aacute;s informaci&oacute;n: Richi, empresario de 23 a&ntilde;os: &quot;Tengo alumnos que cogen el alquiler de un coche por 400 &euro; y ",0.1,9,"/Business & Industrial/Business Operations","2026-01-09 04:57:25","2026-01-09 19:57:36",,,,,,,"Impuesto sobre la nómina, Nómina",
https://okdiario.com/economia/boe-lo-confirma-festivo-10-noviembre-habra-puente-solo-estas-comunidades-espana-15687344,"El BOE lo confirma: es festivo el 10 de noviembre y habrá puente sólo en estas comunidades de España",https://cache.discoversnoop.com/8fc678a9878c20578f84bda4ec55e65db8b91b957c7cdb7c8d9b18bea118760f-1762212271.jfif,Okdiario,okdiario.com,"El próximo lunes 10 de noviembre será festivo en Madrid. Todo lo que debes saber sobre por qué es festivo el 10 de noviembre en Madrid.",0.1,11,"/Hobbies & Leisure/Special Occasions/Holidays & Seasonal Events","2025-11-04 00:21:38","2025-11-04 03:20:27",,,,1,,,puente,
https://www.eldiario.es/comunitat-valenciana/politica/compromis-decision-pedro-sanchez-hay-pasar-palabras-boe_1_11327618.amp.html,"Compromís, sobre la decisión de Pedro Sánchez: ""Hay que pasar de las palabras al BOE""",https://cache.discoversnoop.com/6cb23d921cda3db8ebe987f141e5d8701fe35707f7e5f3edad2dbdc804f72059-1720125902.jfif,"El Diario",eldiario.es,"El portavoz valencianista en las Corts Valencianes considera que el Gobierno debe presentar medidas concretas contra las noticias falsas y la utilización ...",0.1,16,/News/Politics,"2024-04-29 17:12:20","2024-04-30 17:12:12",,,,,,,,
https://www.elnacional.cat/oneconomia/ca/economia/boe-confirma-baixada-nomines-fins-95-milers-treballadors-nou-mei_1496539_102.html,"El BOE confirma una baixada a les nòmines de fins a 95 € per a milers de treballadors pel nou MEI",https://cache.discoversnoop.com/21e1f0e2a3e20ce59dd1c7774cb9882491f7ed4eb04b3ed9568cee3f29a5ad54-1760006809.jfif,"El Nacional.cat",elnacional.cat,"El govern espanyol justifica aquesta mesura com un instrument essencial per a 'preservar l'equilibri entre generacions'",0.1,11,"/Finance/Financial Planning & Management/Retirement & Pension","2025-10-09 12:43:54","2025-10-10 13:44:42",,,,,,,"Butlletí Oficial de l'Estat, Govern d'Espanya, Nòmina, Treballador",
https://amp.elmundo.es/internacional/2026/03/31/69cbde8ee4d4d85d7a8b45d8.html,"EEUU lanza un ataque masivo sobre Isfahán e Irán amenaza con atacar a Microsoft, Google, Apple, Intel, IBM, Tesla y Boeing",https://cache.discoversnoop.com/7366e716f1b85e2046972704a5067e553fba46cb01f1f2961b9d93ace55ef25f-1774977308.jfif,"El Mundo",elmundo.es,"Estados Unidos ha elevado la tensión con Irán este martes, con un ataque aéreo en la ciudad central de Isfahán, al oeste de Teherán, centro neurálgico de la industria de Defensa de",0.1,16,"/Sensitive Subjects","2026-03-31 19:10:55","2026-03-31 19:55:27",,,,,,,"Boeing, IBM, Intel, Irán, Teherán",
https://www.heraldo.es/noticias/economia/2025/08/05/boe-anuncia-procedimiento-devoluciones-irpf-jubilados-mutualistas-1843695.amp.html,"El BOE anuncia el procedimiento de devoluciones de IRPF a los jubilados mutualistas",https://cache.discoversnoop.com/01cf7bd63c30ace0c867038eb1c98d9fe4504531a89790aebe0893fd98bc4cad-1754437071.jfif,heraldo.es,heraldo.es,"El texto del BOE aprobado por la Cámara Baja se incorporó como enmienda a la Ley sobre responsabilidad civil y seguro en la circulación de vehículos a motor.",0.1,12,"/Finance/Financial Planning & Management/Retirement & Pension","2025-08-06 01:34:16","2025-08-06 21:23:23",,,,,,,Mutualidad,
https://elpais.com/espana/2026-02-25/ultima-hora-de-la-desclasificacion-de-los-documentos-del-golpe-de-estado-del-23-f-reacciones-tras-la-aprobacion-del-gobierno-en-directo.html?outputType=amp,"Desclasificación del 23-F, en directo | El BOE publica la orden de la desclasificación de los documentos del 23-F",https://cache.discoversnoop.com/1e0d4f8ce0a982983bca45d0fc930efafb46f2e7331f79ad7a16bd78498e958e-1772012757.jfif,"EL PAÍS",elpais.com,"Urtasun, sobre la publicación de los papeles del 23-F: “Aunque tarde, el Gobierno está haciendo su trabajo”",0.1,16,"/Law & Government/Government","2026-02-25 09:40:45","2026-02-25 12:08:21",,,,,,,"Boletín Oficial del Estado, Congreso de los Diputados, Consejo de Ministros, Ernest Urtasun, Gobierno de España, Palacio de la Moncloa, Periodismo",
https://okdiario.com/comunidad-valenciana/oficial-boe-confirma-festivo-del-9-octubre-habra-puente-ciudades-15505984/amp,"Es oficial: el BOE confirma el festivo del 9 de octubre y habrá puente en estas ciudades",https://cache.discoversnoop.com/5b80cdd7fb06ba336214d87ae82cea3d2324246e35c2c3c6f8cf6f6482cc9182-1759521833.jfif,OkDiario,okdiario.com,"El jueves 9 de octubre es festivo en la Comunidad Valenciana ya que se celebra el día de la comunidad. Todo lo que dice el BOE.",0.1,18,"/Hobbies & Leisure/Special Occasions/Holidays & Seasonal Events","2025-10-03 22:01:02","2025-10-05 15:13:28",,,,,,,"Comunidad Valenciana, Día de la Comunidad Valenciana",
https://www.20minutos.es/lainformacion/economia-y-finanzas/menos-salario-eguridad-social-boe-mecanismo-equidad-intergeneracional_6513290_0.html,"Confirmado por el BOE: la nueva reducción en las nóminas que entrará en vigor el 1 de enero de hasta 95 euros menos",https://cache.discoversnoop.com/44e93bf2dffb5aa0ea9525dfe2fc128de33c497fef04f6c2d62ef0de79e34bb5-1761552094.jfif,20Minutos,20minutos.es,"Según ha confirmado el BOE, el descuento del Mecanismo de Equidad Intergeneracional afectará a los trabajadores para reforzar la hucha de las pensiones.",0.1,13,"/Finance/Financial Planning & Management/Retirement & Pension","2025-10-25 12:34:06","2025-10-28 02:45:21",,,,1,,,"Jubilación, Nómina, Seguridad Social",
https://www.20minutos.es/lainformacion/economia-y-finanzas/boe-confirma-menos-salario-seguridad-social-equidad-intergeneracional-pensiones-enero-2026-hucha_6513290_0.amp.html,"Confirmado por el BOE: la nueva reducción en las nóminas que entrará en vigor el 1 de enero de hasta 95 euros menos",https://cache.discoversnoop.com/6aa6604cff95a156e945185fc3d013bff4f15e6917351a76e2b485b938fd8e9f-1762993976.jfif,20Minutos,20minutos.es,"Según ha confirmado el BOE, el descuento del Mecanismo de Equidad Intergeneracional afectará a los trabajadores para reforzar la hucha de las pensiones.",0.1,11,"/Finance/Financial Planning & Management/Retirement & Pension","2025-11-11 04:18:54","2025-11-13 01:28:42",,,,,,,"Jubilación, Nómina, Seguridad Social",
https://www.elplural.com/autonomias/comunidad-valenciana/pilar-bernabe-desmonta-perez-llorca-boe-mano-miente-jefes-mazon-feijoo_377024102_amp,"Pilar Bernabé desmonta a Pérez Llorca con el BOE en la mano: ""Miente como sus jefes Mazón y Feijóo""",https://cache.discoversnoop.com/011e83b1ddc5bd9a70d1ef1d4c8a67f8aebf0bd59827404ce460983c248e3e7a-1767094133.jfif,ElPlural.com,elplural.com,"Pilar Bernabé desmonta con el BOE en la mano las mentiras de Pérez Llorca sobre la reconstrucción tras la DANA: ""Miente como sus jefes Mazón y Feijóo""",0.1,21,/News/Politics,"2025-12-30 12:25:24","2026-01-01 07:46:20",,,,,,,"Alberto Núñez Feijóo, Partido Popular de la Comunidad Valenciana",
https://as.com/actualidad/economia/es-oficial-en-el-boe-la-reduccion-de-nomina-que-tendran-millones-de-espanoles-a-partir-del-1-de-enero-de-2026-f202512-n/?outputType=amp,"Es oficial en el BOE: la reducción de nómina que tendrán millones de españoles a partir del 1 de enero de 2026",https://cache.discoversnoop.com/8901e2b3cfe1f99c8288bf69f81b2ee1b833a301df5ffc362f451141a45c0c60-1765178412.jfif,"Diario AS",as.com,"El nuevo cambio entrará en vigor el próximo 1 de enero. El recargo sobre la base de cotización será del 0,9%.",0.1,10,"/News/Business News","2025-12-08 08:16:23","2025-12-09 17:17:08",,,,,,,"Jubilación, Nómina",
https://amp.elmundo.es/cataluna/2025/02/27/67c0372de4d4d8b0708b45bb.html,"¿Es festivo el 28 de febrero en Cataluña? Esto es lo que dice el BOE de manera oficial",https://cache.discoversnoop.com/24cd32dc6828229778a7ca4ec72502892832dbcdca0ad6a00bfdd5b1fe6091c5-1740668265.jfif,"El Mundo",elmundo.es,"Con el paso de los días desde el último festivo, es natural que muchos esperen con ansias un merecido descanso. El Boletín Oficial del Estado (BOE), con su resolución del 15 de oct",0.1,12,"/Hobbies & Leisure/Special Occasions/Holidays & Seasonal Events","2025-02-27 15:56:09","2025-02-27 20:10:41",,,,,,,Carnaval,
https://andaluciaorienta.net/788-plazas-empleo-publico-en-andalucia,"788 plazas de Empleo Público en Ayuntamientos de Andalucía (pendientes de publicación en el BOE)",https://cache.discoversnoop.com/9f66a4f1a7bc465fe556a5f8f4d7294ba472f1baea7716c15ac230af24333118-1757885152.jfif,"Andalucia Orienta",andaluciaorienta.net,"788 plazas de Empleo Público en Andalucía: Ayuntamientos y Diputaciones (BOP Sevilla, Málaga, Jaén, Huelva, Granada, Córdoba, Cádiz, Almería).",0.1,10,"/Jobs & Education/Jobs/Job Listings","2025-09-14 23:22:54","2025-09-16 19:27:46",,,,,,,"Andalucía, Asistente administrativo, Empleo público",
https://www.elconfidencial.com/amp/alma-corazon-vida/2025-06-08/botones-azar-caida-inexplicable-vuelo-3591-atlas-air_4146032/,"Apretando botones al azar: la caída inexplicable en 32 segundos de un Boeing 767 que funcionaba perfectamente",https://cache.discoversnoop.com/1366307c784d13f466fbbd52500c6f422635dade63f3ee118c89eebcf35486d4-1749359739.jfif,"El Confidencial",elconfidencial.com,"La aeronave del vuelo 3591 de Atlas Air, en perfecto estado, con todos sus sistemas funcionando y en condiciones meteorológicas operables, terminó de la peor manera en un instante",0.1,11,"/Sensitive Subjects","2025-06-08 01:13:37","2025-06-09 16:31:09",,,,,,,"Aviones, Boeing, Vuelos",
https://okdiario.com/economia/publicado-boe-adios-jamon-pavo-aceitunas-rellenas-como-conocias-hasta-ahora-16332904,"Publicado en el BOE: adiós al jamón de pavo y a las aceitunas rellenas como las conocías hasta ahora",https://cache.discoversnoop.com/9830057802950a7655cb11f1f4d4507f57572ceb4868447bcae984e30812bf61-1772530365.jfif,Okdiario,okdiario.com,"El Gobierno introduce en el BOE cambios que afectan al jamón de pavo, pan sin gluten o las aceitunas. Lo que debes saber.",0.1,7,"/Food & Drink/Food & Grocery Retailers","2026-03-03 10:27:11","2026-03-04 08:21:40",,,,1,,,"Aceituna, Aceituna rellena, Carne de pavo, Jamón",
https://noticiastrabajo.huffingtonpost.es/amp/empleo/oposiciones/boe-lanza-oposiciones-mas-interesantes-julio-20490-plazas-convocadas/,"El BOE lanza las oposiciones más interesantes para el mes de julio: hasta 20.490 plazas convocadas",https://cache.discoversnoop.com/6854c720008272d18b2c21d2c0b4144fb9b16f1f349453b6374749ea0eb4c85d-1722393960.jfif,Noticiastrabajo,huffingtonpost.es,"El Boletín Oficial del Estado difunde en el mes de julio 394 convocatorias de oposiciones con más de 20.490 plazas, para las que en muchas solo piden la ...",0.1,8,"/Jobs & Education/Education/Standardized & Admissions Tests","2024-07-31 04:45:23","2024-07-31 10:01:54",,,,,,,,
https://www.heraldo.es/noticias/economia/2026/03/18/boe-confirma-ayuda-100euros-propietarios-perros-gatos-mascotas-andalucia-1901622.amp.html,"El BOE confirma una ayuda de 100 euros a los propietarios de perros en esta comunidad",https://cache.discoversnoop.com/7ee5786f75e86f26be5f7f5b7e52ba0c6aa0912adc18b65a2e130d1ed89a340d-1773834195.jfif,"Heraldo de Aragón",heraldo.es,"Permitirá que en una región española sea posible deducir los gastos veterinarios de aquellos que sean dueños de perros, gatos u otras mascotas.",0.1,12,"/Pets & Animals/Pets/Dogs","2026-03-18 11:46:49","2026-03-20 13:36:40",,,,,,,"Boletín Oficial del Estado, Mascota, Perro",
https://talent24h.okdiario.com/la-nueva-moneda-de-2-euros-llega-a-espana-en-2026-y-sera-de-curso-legal-en-toda-la-zona-euro-el-boe-lo-confirma/,"La nueva moneda de 2 euros llega a España en 2026 y será de curso legal en toda la zona euro: el BOE lo confirma",https://cache.discoversnoop.com/08e925222c1eedbe2568f09f1cefd53c5fb8c01c815d39fc16687ce6099813c8-1766234552.jfif,Talent24h,okdiario.com,"El BOE confirma la emisión en 2026 de una nueva moneda de 2 euros dedicada al Monasterio de Poblet (Tarragona).",0.1,14,"/Finance/Investing/Currencies & Foreign Exchange","2025-12-20 13:39:08","2025-12-28 10:37:18",,,,,,,"Eurozona, Moneda de dos euros, Monedas de euro",
https://okdiario.com/economia/boe-confirma-adios-bares-restaurantes-siempre-nueva-ley-que-lo-cambia-todo-15393699/amp,"El BOE lo hace oficial: adiós a los bares y restaurantes de siempre por la nueva ley que lo cambia todo",https://cache.discoversnoop.com/5904031989e01b7f92916bf3b1a3625cde8c29e8aaf3b2fca4c028185aa98ea6-1764866468.jfif,OkDiario,okdiario.com,"La nueva ley antitabaco endurece restricciones en terrazas, váper y conciertos. Estas son las claves del anteproyecto y lo que queda por aprobar.",0.1,9,"/Law & Government/Legal","2025-12-04 17:36:53","2025-12-05 19:04:43",,,,,,,"Consejo de Ministros, Fumar, prohibido fumar",
https://noticiastrabajo.huffingtonpost.es/amp/economia/consumo/el-precio-de-la-gasolina-y-diesel-vuelve-a-subir-tras-la-bajada-del-iva-anunciada-en-el-boe-las-gasolineras-mas-baratas-por-provincias/,"El precio de la gasolina y diésel vuelve a subir tras la bajada del IVA anunciada en el BOE: las gasolineras más baratas por provincias",https://cache.discoversnoop.com/d3c01a63a24f5c353705dc664336c82a6492b5348f7c7b8d5245b9859a8ea640-1774367103.jfif,Noticiastrabajo,huffingtonpost.es,"Tras varios días de bajada, el precio de la gasolina sin plomo 98 sube 0,003 euros por litro y el del diésel, gasóleo A, 0,001 euros por litro.",0.1,16,"/Autos & Vehicles/Vehicle Parts & Services/Gas Prices & Vehicle Fueling","2026-03-24 16:27:42","2026-03-26 14:23:29",,,,,,,"Combustible, Estación de servicio",
https://www.eldiario.es/politica/boe-publica-jubilacion-forzosa-edad-juez-garcia-castellon_1_11622120.amp.html,"El BOE publica la jubilación forzosa por edad del juez García Castellón",https://cache.discoversnoop.com/299b053cfb27273a0f776ab7ef5bb8c2de101829f5ff008fd2980fdbd86af81b-1725267760.jfif,"El Diario",eldiario.es,"El Boletín Oficial del Estado (BOE) ha publicado este lunes 2 de septiembre la jubilación del juez de la Audiencia Nacional Manuel García Castellón, ...",0.1,10,"/Law & Government/Government/Courts & Judiciary","2024-09-02 11:01:32","2024-09-02 22:06:51",,,,,,,,
https://www.xataka.com/transporte/boeing-atrapada-guerra-comercial-china-paraliza-entregas-sus-aviones-airbus-gana-terreno-bloomberg/amp,"Boeing, atrapada en la guerra comercial. China paraliza las entregas de sus aviones y Airbus gana terreno, según Bloomberg",https://cache.discoversnoop.com/dff13c915ac09b5d5d58687c1f12b814c3a466c17688cc7d80a07de0a091abb2-1744771304.jfif,Xataka,xataka.com,"La tensión comercial entre Estados Unidos y China no da señales de disminuir. Y todo apunta a que la aviación comercial será una de las grandes damnificadas....",0.1,13,"/Business & Industrial","2025-04-16 04:39:51","2025-04-16 09:01:04",,,,,,,"Airbus, Boeing, Guerra comercial",
https://elpais.com/espana/2026-04-01/el-gobierno-oficializa-su-reorganizacion-en-el-boe.html?outputType=amp,"El Gobierno oficializa su reorganización en el BOE",https://cache.discoversnoop.com/0f752c5eee218e87db144f817f7623422d7dceb351890d934dc11f6a4544331e-1775054071.jfif,"EL PAÍS",elpais.com,"Cuerpo pasa a presidir, como vicepresidente primero, la comisión de Inteligencia",0.1,24,"/Law & Government/Government","2026-04-01 16:19:19","2026-04-03 10:19:50",,,,,,,"Boletín Oficial del Estado, Consejo de Ministros, Gobierno de España",
https://www.lasprovincias.es/comunitat/ampliacion-enlace-bypass-valencia-2028-20251219093753-nt_amp.html,"El BOE publica la mejora del enlace de la A-3 pero esta no llegará antes de 2028",https://cache.discoversnoop.com/76b39105b8a74c63555b9277e78da441ab94c96e701c541594a5c01fe1ffbec1-1766186494.jfif,"Las Provincias",lasprovincias.es,"El proyecto supera los 3,3 millones de presupuesto y busca solventar el embudo que se genera para acceder al by-pass al haber un solo carril",0.1,20,"/Business & Industrial/Construction & Maintenance","2025-12-19 23:52:47","2025-12-20 07:42:38",,,,,,,"Autovía del Este",
https://okdiario.com/economia/publicado-boe-23-abril-festivo-habra-puente-escolar-estas-comunidades-16561010/amp,"Publicado en el BOE: el 23 de abril es festivo y habrá puente escolar en estas comunidades",https://cache.discoversnoop.com/1d54befd65aa55a3f68610689501146f4d133e386d5512d47bc6869a89187b4e-1775985576.jfif,OkDiario,okdiario.com,"El próximo 23 de abril dos comunidades autónomas de España disfrutarán de un día festivo. Los estudiantes de éstas no tendran clase.",0.1,14,"/Hobbies & Leisure/Special Occasions/Holidays & Seasonal Events","2026-04-12 01:43:21","2026-04-13 12:33:20",,,,,,,"Calendario laboral, Día festivo, puente",
https://www.laopiniondemurcia.es/buzzeando/2025/02/26/buenas-noticias-murcianos-boe-confirma-dv-114696925.amp.html,"Buenas noticias para los murcianos: el BOE confirma el próximo festivo que solo tiene esta Comunidad y otra más",https://cache.discoversnoop.com/09a3cc0192a9fac712fe317f574c347fdd5d0d3c2357e48537f3fe12dc75dfd8-1740575853.jfif,"La Opinión de Murcia",laopiniondemurcia.es,"Junto con la Comunidad Valenciana, la Región de Murcia es la única comunidad que celebra el festivo este año",0.1,11,"/Hobbies & Leisure/Special Occasions/Holidays & Seasonal Events","2025-02-26 14:16:33","2025-03-01 06:22:45",,,,,,,"Murcia, Región de Murcia",
https://www.elmundo.es/ciencia-y-salud/salud/2025/12/10/69393868fc6c83ff398b4582.html,"Esto es lo que puede provocar un tromboembolismo pulmonar como el que retiró de los escenarios a Robe Iniesta, líder de Extremoduro",https://cache.discoversnoop.com/24c427b8e546b1e4b3f7e4f9b7d12a4930b9eb8710975d7d1bd64e69188aa481-1765373982.jfif,"El Mundo",elmundo.es,"Robe Iniesta, líder de Extremoduro e icono absoluto del rock español, ha muerto este miércoles. Muchas son las incognitas que todavía hay sobre la causa de su fallecimiento,...",0.1,8,"/Sensitive Subjects","2025-12-10 11:28:52","2025-12-11 22:24:25",,,,1,,,"Coagulación, Roberto Iniesta, Trombosis",
