url,title,image,publisher,publisher_url,snippet,score,position,category,firstviewed,lastviewed,is_new,is_headline,is_short,is_showcase,is_video,is_webstory,entities,"social channel"
https://noticiastrabajo.huffingtonpost.es/amp/economia/miles-trabajadores-notaran-nomina-nueva-deduccion-hasta-340-euros-aprobada-boe/,"Miles de trabajadores notarán en la nómina una nueva deducción de hasta 340 euros aprobada en el BOE",https://cache.discoversnoop.com/17e4beb7a158956024cec454e637895d7736f3e10a219eb5596adbd6b9b5c133-1758417330.jfif,Noticiastrabajo,huffingtonpost.es,"Los asalariados que perciban menos de 18.276 euros al año podrán acceder a una nueva deducción en el IRPF de hasta 340 euros, según establece la Ley 5/2025 publicada en el Boletín Oficial del Estado.",10.4,8,"/Finance/Accounting & Auditing/Tax Preparation & Planning","2025-09-21 03:12:06","2025-09-22 21:29:52",,,,,,,"Derecho laboral, Impuesto sobre la renta, Nómina",
https://lagradaonline.com/actualidad/precio-bombona-butano/,"Confirmado por el BOE: este será el precio de la bombona de butano a partir del 1 de enero de 2025",https://cache.discoversnoop.com/f39f8607c9453e954b906e3c174282c3ac04166ad1c28d52ab3d1b052023d26f-1736157200.jfif,"La Grada",lagradaonline.com,"A partir de mañana comenzamos años y también novedades en un tema que interesa a muchos. El precio de la bombona de butano en España seguirá siendo un tema...",9.7,6,"/Business & Industrial/Energy & Utilities/Oil & Gas","2025-01-06 10:52:18","2025-01-08 16:13:55",,,,,,,,
https://www.xataka.com/otros/alguien-ha-comprado-boeing-737-desuso-ha-convertido-vivienda-lujo-jacuzzi-helipuerto/amp,"Alguien se ha comprado un Boeing 737 en desuso y ha hecho lo que todos habríamos hecho: convertirlo en una mansión",https://cache.discoversnoop.com/15cc254cb8f9f88a11f55813f679e7009d7704e124d49ebd2673d9431697c8bb-1720143828.jfif,Xataka,xataka.com,"No todas las aeronaves acaban en cementerios de aviones cuando se cumple su ciclo de vida. Algunas unidades, aunque ya no puedan volar, son utilizadas para.",9.6,13,"/Autos & Vehicles","2024-04-18 17:10:29","2024-04-27 15:18:24",,,,,,,,
https://okdiario.com/economia/boe-confirma-festivo-del-9-diciembre-espana-13848857/amp,"El BOE confirma el festivo del 9 de diciembre en España",https://cache.discoversnoop.com/1830aeb7b332389311d80af4970fb1ab9da35e02d1f9bcac35197e44f63ef70e-1732226323.jfif,OkDiario,okdiario.com,"El lunes 9 de diciembre será festivo en algunas comunidades autónomas. Consulta las comunidades autónomas en las que será festivo el día 9.",8.5,5,"/Hobbies & Leisure/Special Occasions/Holidays & Seasonal Events","2024-11-21 22:57:57","2024-11-24 07:44:57",,,,,,,,
https://lagradaonline.com/actualidad/nuevo-precio-bombona/,"El nuevo precio de la bombona de butano a partir del 1 de enero de 2025: el BOE lo hace oficial",https://cache.discoversnoop.com/d41adf8b071e0eea216141339f53d2c438be9f487f589d1e57de902334dac65e-1735853475.jfif,"La Grada",lagradaonline.com,"A partir de mañana comenzamos años y también novedades en un tema que interesa a muchos. El precio de la bombona de butano en España seguirá siendo un tema...",8.3,5,"/Business & Industrial/Energy & Utilities/Oil & Gas","2025-01-02 22:30:19","2025-01-05 13:38:31",,,,,,,,
https://noticiastrabajo.huffingtonpost.es/amp/economia/miles-de-trabajadores-notaran-en-la-nomina-una-nueva-deduccion-de-hasta-340-euros-aprobada-en-el-boe/,"Miles de trabajadores notarán en la nómina una nueva deducción de hasta 340 euros aprobada en el BOE",https://cache.discoversnoop.com/7dc29398593b03055275dfc996ae81331d42fa50411be48a7ff3215235476ecb-1755351346.jfif,Noticiastrabajo,huffingtonpost.es,"Los trabajadores que cobren menos de 18.276 euros anuales podrán beneficiarse de una nueva deducción en el IRPF de hasta 340 euros, según recoge la Ley 5/2025, publicada en el BOE.",7.5,7,"/Finance/Accounting & Auditing/Tax Preparation & Planning","2025-08-16 15:32:33","2025-08-18 14:21:40",,,,,,,"Derecho laboral, Impuesto sobre la renta, Nómina",
https://www.lne.es/tv-espectaculos/2024/09/11/boe-confirma-adios-cambio-hora-108009877.html,"El BOE lo confirma: adiós al cambio de hora en España",https://cache.discoversnoop.com/c86104060c08cd36378676d2091474015d4993431df8ee639871c36bf9628fc1-1726150370.jfif,"La Nueva España",lne.es,"Queda menos para el esperado y dudoso cambio de hora. España, y el resto de Europa, volverá a cambiar el reloj oficialmente. . En esta ocasión, el cambio ...",7.4,5,"/Reference/General Reference/Time & Calendars","2024-09-12 16:11:47","2024-09-14 15:00:42",,,,,,,,
https://amp.ultimahora.es/xaloc/dudas-respuestas/2025/08/21/2453493/boe-confirma-instalar-maquina-aire-acondicionado-fachada-esta-prohibido-segun-ley-propiedad-horizontal.html,"El BOE lo confirma: instalar la máquina de aire acondicionado en la fachada está prohibido, según la ley de Propiedad Horizontal",https://cache.discoversnoop.com/22725f98360157c8068b28aac71990bd7ed925c07385892213121666bea56ae9-1755780434.jfif,"Ultima Hora",ultimahora.es,"Un experto de Millennials Abogados detalla las implicaciones legales y las excepciones contempladas en la normativa que afecta a millones de comunidades de vecinos. La instalación de aparatos de aire acondicionado en las fachadas de edificios está expresamente prohibida según establece la ",6.7,9,"/Home & Garden/HVAC & Climate Control","2025-08-21 14:44:19","2025-08-24 03:21:01",,,,,,,"Aire acondicionado, Climatización, Fachada, Propiedad horizontal",
https://andaluciainforma.eldiario.es/tramites/miles-de-nominas-notaran-la-rebaja-con-la-nueva-deduccion-de-hasta-340-euros-aprobada-en-el-boe/,"Miles de nóminas notarán la rebaja con la nueva deducción de hasta 340 euros aprobada en el BOE",https://cache.discoversnoop.com/f50caecf7e4b45321f1d684924878d1ce82e339b249ff4054715ed60dd56ed8a-1754576063.jfif,Andaluciainforma,eldiario.es,"El BOE aprueba nueva deducción IRPF hasta 340 € para trabajadores con salarios bajos, efectiva desde enero de 2025 en España.",6.4,7,"/Finance/Accounting & Auditing/Tax Preparation & Planning","2025-08-07 16:10:45","2025-08-09 10:19:22",,,,,,,Nómina,
https://okdiario.com/economia/boe-lo-hace-oficial-sera-festivo-23-junio-san-juan-habra-puente-estas-comunidades-autonomas-14967119/amp,"El BOE lo hace oficial: será festivo el 23 de junio por San Juan y habrá puente en estas comunidades autónomas",https://cache.discoversnoop.com/95a96d0e03248c6acd66a7975c7161e87291d331f31261bb2f0d1e52b1473242-1750316067.jfif,OkDiario,okdiario.com,"San Juan será festivo el 24 de junio en varias comunidades y municipios de España. Consulta dónde habrá puente, qué se celebra y cómo se vive esta noche mágica.",6.1,6,"/Hobbies & Leisure/Special Occasions/Holidays & Seasonal Events","2025-06-19 08:52:24","2025-06-23 21:08:39",,,,,,,"Calendario laboral, Día festivo, Hogueras de Alicante, Noche de San Juan",
https://okdiario.com/economia/oficial-boe-confirma-festivo-del-28-febrero-habra-puente-14246749,"Es oficial: el BOE confirma el festivo del 28 de febrero y habrá puente",https://cache.discoversnoop.com/7ffe6944e105b9d7a31da619b91631a2dc6d277c6aa505a3f053a411e8752c1c-1739132105.jfif,OkDiario,okdiario.com,"Es oficial: el BOE confirma el festivo del 28 de febrero y habrá puente en una comunidad autónoma en concreto. ¿Cuál es y por qué se celebra esta fiesta?.",6,8,"/Hobbies & Leisure/Special Occasions/Holidays & Seasonal Events","2025-02-09 21:14:02","2025-02-11 18:51:03",,,,1,,,"Calendario, Calendario laboral, Celebración, puente",
https://okdiario.com/curiosidades/nueva-fecha-confirmada-boe-pone-fecha-cambio-hora-adelanta-14191304/amp,"Nueva fecha confirmada: el BOE pone fecha al cambio de hora y se adelanta",https://cache.discoversnoop.com/f611232ef4c19896753a2c814ddfc0c4fd0396e2f7d886d38b8537c0ac133314-1738161153.jfif,OkDiario,okdiario.com,"El Boletín Oficial del Estado (BOE) ha publicado un calendario oficial con la fecha del próximo cambio de hora.",6,9,"/Reference/General Reference/Time & Calendars","2025-01-29 15:31:34","2025-02-01 09:59:25",,,,,,,"Horario de invierno, Horario de verano, Horario de verano y Horario de invierno, Huso horario de España, Huso horario de España y Horario de invierno",
https://okdiario.com/economia/boe-confirma-festivo-del-13-octubre-solo-estas-comunidades-puente-oficial-15525786/amp,"El BOE confirma el festivo del 13 de octubre sólo en estas comunidades: el puente es oficial",https://cache.discoversnoop.com/4903b04b0d2bdc05a06690fa67c9455f86d8bbdab961bcc6ebe37225a47825f9-1759758369.jfif,OkDiario,okdiario.com,"El BOE confirma el festivo del 13 de octubre de 2025 en solo seis comunidades. Consulta dónde habrá puente del Pilar y quién trabajará el lunes.",5.9,8,"/Hobbies & Leisure/Special Occasions/Holidays & Seasonal Events","2025-10-06 15:42:22","2025-10-08 11:32:18",,,,,,,"Calendario laboral, Día de la Hispanidad, Fiesta Nacional de España, puente",
https://madridinforma.eldiario.es/el-boe-confirma-una-nueva-deduccion-en-el-irpf-de-tu-nomina/,"El BOE confirma una nueva deducción en el IRPF de tu nómina",https://cache.discoversnoop.com/c1e378c5ef5c376d6456639ca0f5af7e140f1348fb9499b453f67d3ecb44b438-1757882748.jfif,Madridinforma,eldiario.es,"El BOE aprueba una nueva deducción en el IRPF que beneficiará a trabajadores con nóminas bajas, aplicable en la Renta 2026.",5.5,11,"/Finance/Accounting & Auditing/Tax Preparation & Planning","2025-09-14 22:42:14","2025-09-16 20:07:28",,,,,,,"Declaración de la renta, Impuesto sobre la renta, Nómina",
https://www.mundodeportivo.com/solobici/20251010/1002548110/boe-da-luz-verde-eliminar-arcenes-para-construir-carriles-bici-segregados.html?facet=amp,"El BOE da luz verde a la eliminación de arcenes que podría echar de las carreteras a miles de ciclistas",https://cache.discoversnoop.com/b3ad765c1941328fa302f8e3e782187ec3ba01b45cc8dc04d2f073cef7fa55b6-1760136075.jfif,"Mundo Deportivo",mundodeportivo.com,"La polémica nueva norma del Gobierno de España para eliminar arcenes, construir carriles bici segregados y limitar la circulación de ciclistas por la calzada.",5.2,11,"/Autos & Vehicles/Vehicle Codes & Driving Laws","2025-10-11 00:37:22","2025-10-13 10:17:19",,,,,,,"Bicicleta, Ciclismo, Ciclovía, Deporte, Seguridad vial",
https://www.diariodesevilla.es/sociedad/guia-cambio-horario-invierno-2025_0_2004704084.amp.html,"¿Cuándo empieza el horario de invierno? El BOE confirma la fecha en la que cambia la hora",https://cache.discoversnoop.com/e1ffbe06517ad649666f95de202ace0c89475fe3e458c9c62b691680290fb96f-1757245049.jfif,"Diario de Sevilla",diariodesevilla.es,"El Boletín Oficial del Estado (BOE) establece las fechas de los cambios de horario, en coordinación con el resto de Estados de la Unión Europea",5.1,9,"/Reference/General Reference/Time & Calendars","2025-09-05 21:54:10","2025-09-09 18:52:06",,,,,,,"Hora, Horario de invierno",
https://okdiario.com/economia/oficial-boe-confirma-festivo-del-28-febrero-habra-puente-14246749/amp,"Es oficial: el BOE confirma el festivo del 28 de febrero y habrá puente",https://cache.discoversnoop.com/80d6a491f57c909b9bbc449111038cbfd87c09e4eaef561f6227784cf764ca8e-1739099783.jfif,OkDiario,okdiario.com,"Es oficial: el BOE confirma el festivo del 28 de febrero y habrá puente en una comunidad autónoma en concreto. ¿Cuál es y por qué se celebra esta fiesta?.",5,6,"/Hobbies & Leisure/Special Occasions/Holidays & Seasonal Events","2025-02-09 12:15:17","2025-02-11 19:34:40",,,,,,,"Boletín Oficial del Estado, Calendario, Calendario laboral, Celebración, puente",
https://noticiastrabajo.huffingtonpost.es/amp/economia/consumo/miles-de-familias-tendran-un-descuento-del-575-en-la-factura-de-la-luz-tras-la-aprobacion-en-el-boe-en-2026/,"Miles de familias tendrán un descuento del 57,5% en la factura de la luz tras la aprobación en el BOE en 2026",https://cache.discoversnoop.com/ed04b9bdb59522f31959038b95b59544d0f5035854f8ebc481c499f8b9da0bad-1766725844.jfif,Noticiastrabajo,huffingtonpost.es,"El Gobierno extiende hasta el 31 de diciembre de 2026 la prohibición de cortar los suministros básicos y consolida las rebajas extraordinarias del bono social, que oscilarán entre el 42,5% y el 57,5% según el grado de vulnerabilidad, tal y como recoge el Real Decreto-ley 16/2025.",4.9,7,"/Business & Industrial/Energy & Utilities/Electricity","2025-12-26 06:08:04","2025-12-28 01:44:11",,,,,,,"Descuentos y bonificaciones, Factura de la corriente, factura de la corriente",
https://noticiastrabajo.huffingtonpost.es/amp/economia/confirmado-por-el-boe-miles-de-familias-podran-acceder-en-2026-a-una-ayuda-por-hijo-a-cargo/,"Confirmado por el BOE: miles de familias podrán acceder en 2026 a una ayuda por hijo a cargo",https://cache.discoversnoop.com/4e3c20a51d9f8d9499b69685f3ed5486c7d8de8755fcd7c254fe542f9fc9eb90-1766935343.jfif,Noticiastrabajo,huffingtonpost.es,"La cuantía por cada hijo o hija menor de 18 años a cargo en 2026 será de 588 euros al año.",4.9,8,"/Law & Government/Social Services","2025-12-28 16:19:15","2025-12-30 14:38:14",,,,,,,"Boletín Oficial del Estado, Ingreso mínimo vital, prestación por hijo",
https://as.com/actualidad/economia/es-oficial-en-el-boe-la-deduccion-de-hasta-9000-euros-que-podran-solicitar-millones-de-espanoles-en-la-renta-2025-26-f202601-n/?outputType=amp,"Es oficial en el BOE: la deducción de hasta 9.000 euros que podrán solicitar millones de españoles en la Renta 2025-26",https://cache.discoversnoop.com/c3950c550d090493d4342bb0deee1cb730037fe1c654642141d6ecad17b3ab80-1767626593.jfif,"Diario AS",as.com,"Esta medida económica es una prórroga anunciada en el Real Decreto-ley 16/2025 publicado el pasado 23 de diciembre para las obras de mejora por eficiencia.",4.2,10,"/Finance/Accounting & Auditing/Tax Preparation & Planning","2026-01-05 16:19:11","2026-01-08 00:20:23",,,,,,,"Boletín Oficial del Estado, Impuesto sobre la renta",
https://okdiario.com/curiosidades/no-habra-cambio-horario-invierno-100-confirmado-boe-13464002/amp,"No habrá cambio con el horario de invierno: 100% confirmado por el BOE",https://cache.discoversnoop.com/4e216e1044199c66db9accc4baf0aba21e6fb4a840fe67fc6522b52fc79bf588-1726478167.jfif,OkDiario,okdiario.com,"Todo lo que debes saber sobre lo que dice el BOE sobre el cambio horario. La hora se cambia el próximo último fin de semana de octubre.",4.1,4,"/Reference/General Reference/Time & Calendars","2024-09-16 11:15:28","2024-09-19 11:15:01",,,,,,,,
https://okdiario.com/economia/boe-confirma-festivo-del-28-febrero-habra-puente-oficial-14246749/amp,"El BOE confirma el festivo del 28 de febrero y habrá puente: es oficial",https://cache.discoversnoop.com/7fd45809daf98ab3a7ba9c6bada57312a4a10a7b9f8048683d1bdd5af6d252b5-1739710722.jfif,OkDiario,okdiario.com,"El BOE confirma el festivo del 28 de febrero y habrá puente en una comunidad autónoma en concreto. Ya es oficial. ¿Cuál es y por qué se celebra?.",4.1,5,"/Hobbies & Leisure/Special Occasions/Holidays & Seasonal Events","2025-02-16 13:57:26","2025-02-17 19:36:39",,,,,,,"Calendario laboral, Día nacional, puente",
https://noticiastrabajo.huffingtonpost.es/economia/miles-de-trabajadores-notaran-en-la-nomina-una-nueva-bajada-de-sueldo-de-hasta-95-euros-por-el-mei-aprobado-en-el-boe-para-la-mayoria-de-salarios-seran-unos-pocos-de-euros/,"Miles de trabajadores notarán en la nómina una nueva bajada de sueldo de hasta 95 euros por el MEI aprobado en el BOE: para la mayoría de salarios serán unos pocos de euros",https://cache.discoversnoop.com/5fae410f5861a783d7359ce64b445adc5cccda9e68779fe07b468570f917bbf0-1764651322.jfif,Noticiastrabajo,huffingtonpost.es,"Todos los trabajadores, independientemente de su sueldo, deben abonar esta nueva cotización destinada al Fondo de Reserva de la Seguridad Social que no se usará para pagar sus pensiones y que para los salarios más bajos serán unos pocos euros, pero para los más altos la deducción anual pue",3.9,7,"/Finance/Financial Planning & Management/Retirement & Pension","2025-11-30 22:36:30","2025-12-03 09:25:52",,,,1,,,"Jubilación, Nómina",
https://gaceta.es/espana/el-gobierno-cuela-en-el-boe-una-nueva-cotizacion-obligatoria-destinada-a-la-hucha-de-las-pensiones-que-restara-hasta-95-euros-de-la-nomina-20251006-1719/amp/,"El Gobierno cuela una nueva cotización obligatoria en el BOE",https://cache.discoversnoop.com/a44d2bf006f408d7285b7e5b3942a9b08be25a14bca11901cbf7acedc4390115-1759790035.jfif,"La Gaceta de la Iberosfera",gaceta.es,,3.5,9,"/Finance/Financial Planning & Management/Retirement & Pension","2025-10-07 00:30:37","2025-10-08 19:11:04",,,,,,,"Jubilación, Nómina, Pensión, Seguridad Social, Seguridad social",
https://noticiastrabajo.huffingtonpost.es/amp/economia/miles-de-trabajadores-notaran-en-la-nomina-una-nueva-bajada-de-sueldo-de-hasta-95-euros-por-el-mei-aprobada-en-el-boe/,"Miles de trabajadores notarán en la nómina una nueva bajada de sueldo de hasta 95 euros por el MEI, aprobado en el BOE",https://cache.discoversnoop.com/a7a9d4378d7fccb4da123a4362b06328caebd83d0814fff939aef54f10cd9edd-1759603099.jfif,Noticiastrabajo,huffingtonpost.es,"Todos los trabajadores, independientemente de su sueldo, deben abonar esta nueva cotización destinada al Fondo de Reserva de la Seguridad Social. Para los salarios más bajos el importe es de unos pocos euros, pero para los salarios más altos la deducción anual puede llegar hasta los 95 eur",3.5,6,"/Finance/Financial Planning & Management/Retirement & Pension","2025-10-04 20:34:25","2025-10-06 20:05:04",,,,,,,"Jubilación, Nómina, Pensión no contributiva, Seguridad social",
https://www.eleconomista.es/motor/noticias/13595355/10/25/adios-a-los-ciclistas-por-carretera-el-boe-da-via-libre-a-sustituir-los-arcenes-por-carriles-bici-en-estas-carreteras-espanolas.html,"Adiós a los ciclistas por carretera: el BOE da vía libre a sustituir los arcenes por carriles bici en estos tramos de la Red Nacional",https://cache.discoversnoop.com/268f4cb5feec546d02b222916e27b8ee0ae1e4707d37cd1a8abcf66f7f12413c-1760695306.jfif,"El Economista",eleconomista.es,"El pasado miércoles 8 de octubre, el Pleno del Congreso aprobó el proyecto de Ley de Movilidad Sostenible, que tiene como objetivo evolucionar hacia una movilidad más limpia, segura y conectada. En consonancia con esos propósitos, el Boletín Oficial del Estado ha confirmado una modificació",3.4,7,"/Sports/Individual Sports/Cycling","2025-10-17 01:04:02","2025-10-17 23:10:22",,,,,,,"Bicicleta, Ciclismo, Ciclovía",
https://noticiastrabajo.huffingtonpost.es/amp/empleo/oposiciones/el-boe-lanza-las-oposiciones-mas-interesantes-para-2025-con-500-convocatorias-y-mas-de-11000-plazas/,"El BOE lanza las oposiciones más interesantes para 2025 con 500 convocatorias y más de 11.000 plazas",https://cache.discoversnoop.com/b24a099e7011aa68443d32610b956e407598ac6f43e0035cd613e9787d21f63d-1734982892.jfif,Noticiastrabajo,huffingtonpost.es,"El Boletín Oficial del Estado publica para final de año más de 500 convocatorias de oposiciones con más de 11.000 plazas.",3.4,7,"/Jobs & Education/Education/Standardized & Admissions Tests","2024-12-23 20:40:43","2024-12-25 10:53:43",,,,,,,,
https://noticiastrabajo.huffingtonpost.es/amp/economia/confirmado-por-el-gobierno-miles-de-propietarios-de-viviendas-podran-acceder-en-2026-a-una-deduccion-de-hasta-el-60-en-la-renta-por-obras-tras-la-prorroga-aprobada-en-el-boe/,"Confirmado por el Gobierno: miles de propietarios de viviendas podrán acceder en 2026 a una deducción de hasta el 60% en la Renta por obras tras la prórroga aprobada en el BOE",https://cache.discoversnoop.com/942f6e5113be09c4589c8d59804df96ae917b856eed81b100178fa1daf463838-1766700227.jfif,Noticiastrabajo,huffingtonpost.es,"Aquellos contribuyentes que realicen obras de mejora energética en su vivienda habitual o en edificios residenciales podrán deducirse entre un 20% y un 60% de la inversión, tal y como recoge el Real Decreto-ley 16/2025 publicado en el Boletín Oficial del Estado.",3.3,6,"/Finance/Accounting & Auditing/Tax Preparation & Planning","2025-12-25 23:00:28","2025-12-27 19:43:15",,,,,,,"Edificio residencial, Impuesto sobre la renta",
https://www.eleconomista.es/actualidad/amp/13520651/es-oficial-el-boe-confirma-el-festivo-de-septiembre-y-habra-puente-en-estas-comunidades-autonomas,"Es oficial: el BOE confirma el festivo de septiembre y habrá puente en estas comunidades autónomas",https://cache.discoversnoop.com/4b7ec76504c53e5657ac7324ccd75a613d7b0b5bdf29de96afbbcf5d88e5cfa6-1756427384.jfif,"El Economista",eleconomista.es,"Está a punto de comenzar el mes de septiembre, un periodo que es sinónimo de comienzos, sobre todo, porque todos los niños y estudiantes comienzan el nuevo curso, al mismo tiempo que la mayoría de trabajadores vuelven a casa y al trabajo después de sus vacaciones de verano. Así, son muchos",3,11,"/Hobbies & Leisure/Special Occasions/Holidays & Seasonal Events","2025-08-29 02:26:29","2025-08-30 11:03:48",,,,,,,"Calendario laboral, puente",
https://www.eleconomista.es/motor/amp/13741875/el-boe-lo-confirma-a-partir-de-ahora-estara-prohibido-adelantar-camiones-en-determinados-tramos,"El BOE lo confirma: a partir de ahora estará prohibido adelantar camiones en determinados tramos",https://cache.discoversnoop.com/a4044495003ec668315052f7cd9caffff39dcd74b744bdd982c7855114791a15-1769270543.jfif,"El Economista",eleconomista.es,"El Boletín Oficial del Estado (BOE) ha publicado la resolución de 14 de enero de 2026, de la Dirección General de Tráfico, por la que se establecen medidas especiales de regulación de tráfico durante el año 2026. Dicha norma, que tiene como objetivo mejorar la seguridad vial y la fluidez d",2.8,8,"/Autos & Vehicles/Vehicle Codes & Driving Laws","2026-01-24 16:57:25","2026-01-26 12:55:36",,,,,,,"Boletín Oficial del Estado, Camión, Seguridad vial, adelantamiento",
https://noticiastrabajo.huffingtonpost.es/economia/trabajadores-notaran-nomina-nueva-deduccion-hasta-340-euros-aprobada-boe/," Miles de trabajadores verán en la nómina una nueva deducción de hasta 340 euros aprobada en el BOE",https://cache.discoversnoop.com/500d92f20f0d6dd5d2165a7e7a0d352a4c1fff4ad2ce059434544954987545c4-1762838453.jfif,Noticiastrabajo,huffingtonpost.es,"Los asalariados que perciban menos de 18.276 euros al año podrán acceder a una nueva deducción en el IRPF de hasta 340 euros, según establece la Ley 5/2025 publicada en el Boletín Oficial del Estado.",2.8,12,"/Finance/Accounting & Auditing/Tax Preparation & Planning","2025-11-09 06:40:25","2025-11-15 02:27:56",,,,1,,,"Impuesto sobre la renta, Nómina",
https://noticiastrabajo.huffingtonpost.es/amp/economia/confirmado-por-el-gobierno-miles-de-propietarios-podran-deducirse-hasta-3000-euros-anuales-de-2026-en-la-renta-por-rehabilitar-su-vivienda-tras-la-prorroga-aprobada-en-el-boe/,"Confirmado por el Gobierno: miles de propietarios podrán deducirse en 2026 hasta 3.000 euros en la Renta por rehabilitar su vivienda tras la prórroga aprobada en el BOE",https://cache.discoversnoop.com/90645975be784b447e83c1d8f4ca081e9f5a2b4f22526bfeb7f85d113c5ec046-1767253392.jfif,Noticiastrabajo,huffingtonpost.es,"El Boletín Oficial del Estado publica la prórroga de las deducciones fiscales por mejora energética, lo que permite restar de la cuota del IRPF entre 1.000 y 3.000 euros al año, dependiendo de la ambición de la obra realizada.",2.6,9,"/Home & Garden/Home Improvement","2026-01-01 08:39:23","2026-01-05 21:57:34",,,,,,,"Beneficio fiscal, Declaración de la renta, Edificio residencial, Impuesto sobre la renta",
https://madridinforma.eldiario.es/el-boe-lo-publica-y-los-ayuntamientos-advierten-multa-de-150-euros-por-estar-empadronado-en-un-municipio-y-vivir-en-otro/,"El BOE lo publica y los ayuntamientos advierten: multa de 150 euros por estar empadronado en un municipio y vivir en otro",https://cache.discoversnoop.com/3a1b7df0cb0a8d28ab50ca786f132d16db0ac16a65140d1dd7596ab9a75fd72c-1736752642.jfif,Madridinforma,eldiario.es,"Estar empadronado en un municipio y vivir en otro podría acarrear una multa de hasta 150 euros, según recoge el BOE.",2.6,8,"/Law & Government/Government","2025-01-13 08:15:57","2025-01-15 15:12:52",,,,,,,"Ayuntamiento, Ayuntamiento y Gobierno local, Boletín Oficial del Estado",
https://as.com/actualidad/economia/buenas-noticias-para-millones-de-espanoles-el-boe-publica-la-nueva-deduccion-de-hasta-340-euros-en-el-irpf-para-estos-trabajadores-n/?outputType=amp,"Buenas noticias para millones de españoles: el BOE publica la nueva deducción de hasta 340 euros en el IRPF para estos trabajadores",https://cache.discoversnoop.com/3971818a525e0d5462a9004e0a70e9430ad4fdcec866126e11acbab7207374c1-1753773012.jfif,"Diario AS",as.com,"La nueva medida fiscal busca aliviar a los salarios más bajos.",2.6,9,"/Finance/Accounting & Auditing/Tax Preparation & Planning","2025-07-29 09:07:32","2025-07-31 05:20:25",,,,,,,"Boletín Oficial del Estado, Impuesto sobre la renta",
https://www.lagradaonline.com/actualidad/seguro-obligatorio-patinetes/,"El BOE lo hace oficial: el seguro será obligatorio para patinetes y bicicletas eléctricas a partir de esta fecha",https://cache.discoversnoop.com/8146f19181c6c41b2ee6053bc82da08d10b3788dc72ef8a91d864fbf212a9038-1757944831.jfif,"La Grada",lagradaonline.com,"El seguro en patinetes y bicicletas eléctricas ya es una obligación establecida por ley. Todos aquellos que se desplacen a través de estos medios de",2.5,9,/Finance/Insurance,"2025-09-15 15:53:25","2025-09-16 13:44:38",,,,,,,"Bicicleta, Patinete, Patinete eléctrico",
